,DateTime,Tweet_Id,Tweet,User_Id,Retweet,Location,Label,Country
981,2022-01-04 14:20:13,1478370688134270981,My first two jab be AstraZeneca and my booster be Pfizer didn t have any major side effect sore,3191906775,0,"Leicester, England",Weakly_Positive,
982,2022-01-04 14:18:13,1478370184469569536,He suggest that misinformation about the risk of the AstraZeneca vaccine by European leader includin,1183764803791314944,1,,Neutral,
983,2022-01-04 14:17:55,1478370107873280003,Gina be have a laugh aren t you You be aren t you Please te,999854035,0,"Chester, England",Weakly_Positive,
984,2022-01-04 14:17:37,1478370033277538304,Only Pfizer and Moderna vaccine be be use in Brita,705414726101114880,0,,Neutral,
985,2022-01-04 14:17:18,1478369952327426049,While you be shag your mistress in the office You be too ridiculous to take seriously,19825835,0,"London, England",Highly_Negative,
986,2022-01-04 14:17:08,1478369910958952450,my fit surfing 24 year old nephew in WA a a fly in Fly out surveyor intra WA have myocarditis 2 day,3000745417,0,,Highly_Positive,
987,2022-01-04 14:16:40,1478369793392717831,I can count for you I know 11 positive case rn 10 of which be feel horrible All vaccinate wit,3258572843,0,Cairo,Highly_Negative,
988,2022-01-04 14:15:33,1478369515268624384,Post Vaccination Optic Neuritis Observations From the SARS CoV 2 P,46068140,0,,Neutral,
989,2022-01-04 14:12:05,1478368641812992003,What about all the NHS hospital who have declare internal incident due to,20052899,0,,Highly_Negative,
990,2022-01-04 14:12:02,1478368630572257287,Hancock break his own rule No credibility,173168162,0,Yorkshire and The Humber,Highly_Positive,
991,2022-01-04 14:11:51,1478368583449260033,One year ago you we re have an affair and cream money off the taxpay,19825835,0,"manchester ,center of universe",Neutral,
992,2022-01-04 14:10:27,1478368230611865607,And hospitalization from COVID be decline a a result Great news but then,20052899,0,,Highly_Positive,
993,2022-01-04 14:10:12,1478368166392864773,odx LATEST NEWS new covid variant with 46 mutation worry expert iag cine hur amgo,2776076922,2,"England, United Kingdom",Weakly_Positive,
994,2022-01-04 14:08:43,1478367793410150402,So why have your Govt be so ineffective even against EU country let alon,20052899,0,West London,Neutral,
995,2022-01-04 14:07:22,1478367453877084166,I could imagine you an expert on smear be able to portray it like this,1944466748,0,Middlesbrough,Highly_Positive,
996,2022-01-04 14:06:42,1478367285530267648,Please check it be 6 month to 7 month and the decision be take in May 2021 The way Covaxin get,3056294904,0,"Uppsala, Sweden",Neutral,
997,2022-01-04 14:06:19,1478367188666961928,AstraZeneca 1 have some numbness muscle pain get check all fine 2 AstraZeneca and booster Pfizer no effect at all,1229052022885900290,0,"Under the moon, under the sky",Weakly_Positive,
998,2022-01-04 14:06:07,1478367138515759112,By that logic it should have a 7 day average of ab,20443495,0,"Dalkeith, Scotland",Highly_Negative,
999,2022-01-04 14:04:29,1478366730200096770,Vaccinating everyone on the planet against Covid 19 regularly be not sustainable or affordable Prof Sir Andrew Pollar,3093100473,1,Connelly Country,Neutral,
1000,2022-01-04 14:03:45,1478366543952191488,Professor Sir Andrew Pollard who help develop the AstraZeneca COVID vaccine warn that endless round of booster s,1347994474824278017,2,North Central Texas,Highly_Negative,
1001,2022-01-04 14:03:12,1478366404755795975,do the fact that winter be over during the big roll out pas you by too,1573302680,0,leicester,Neutral,
1002,2022-01-04 14:02:07,1478366132910317575,You be naive to think people will forget,19825835,0,,Highly_Negative,
1003,2022-01-04 14:02:03,1478366115763998734,A great difference would be make by waive vaccine patent and not p,1944466748,0,Witham,Highly_Positive,
1004,2022-01-04 14:01:18,1478365926722572288,I think the more interesting comment be misinformation about the Astrazeneca vaccine especially by,77038000,1,"South West, England",Weakly_Positive,
1005,2022-01-04 14:00:50,1478365810662023169,leave the bloody kid out of it theyre the future of this plane,418169907,0,leicester,Highly_Negative,
1006,2022-01-04 14:00:49,1478365804739678211,One year ago you be deceive the general public and your own family You,19825835,0,"Bexley, London",Weakly_Positive,
1007,2022-01-04 14:00:46,1478365793138229249,Source,20052899,0,London,Neutral,
1008,2022-01-04 14:00:17,1478365672585449472,Hahahahaha thank goodness for sarcastic humour but double gold,999854035,0,,Weakly_Positive,
1009,2022-01-04 14:00:15,1478365662355636224,AstraZeneca Working Student Image Data Science m w d 20 hour per week LifeScienceJobsGermany Ph,51783808,1,France,Neutral,
1010,2022-01-04 13:57:49,1478365052927414273,Did you now,1415281905226948609,0,EU,Neutral,
1011,2022-01-04 13:57:06,1478364870563311627,it all that lobby from pzifer do you not see the brown e,267268201,0,leicester,Neutral,
1012,2022-01-04 13:56:56,1478364829966647308,Former Germany Changerlor Ange,1228664438519160832,0,"Kampala, Uganda",Neutral,
1013,2022-01-04 13:56:52,1478364813529075718,150 000 and count,20052899,0,,Neutral,
1014,2022-01-04 13:55:03,1478364353208496138,That be Macron and the EU That s why there s so much v,269902962,0,"Glasgow, Scotland",Weakly_Positive,
1015,2022-01-04 13:54:39,1478364253304225794,Thank you,48289662,0,Sydney,Neutral,
1016,2022-01-04 13:53:49,1478364044725829634,It s the best vaccine for Omicron apparently,1168941372432420866,0,"Glasgow, Scotland",Highly_Positive,
1017,2022-01-04 13:53:04,1478363854866374666,That s why the EU state have so much vaccine hesitancy,1944466748,0,"Glasgow, Scotland",Weakly_Positive,
1018,2022-01-04 13:51:11,1478363380356366342,Hands Face Back to my place right Mattie,19825835,0,"Norfolk, UK",Weakly_Positive,
1019,2022-01-04 13:47:50,1478362537209044993,All research into vaccine mixi,1228664438519160832,0,,Neutral,
1020,2022-01-04 13:45:06,1478361851469647885,And how many people be go to die because of the gigantic leap in f,1944466748,0,,Highly_Positive,
1021,2022-01-04 13:44:06,1478361600797163523,I reckon that be partially it but I also think that AstraZeneca to some extent be try to save f,4246789828,0,Westminster,Highly_Negative,
1022,2022-01-04 13:42:38,1478361228967919617,And you be,19825835,0,,Neutral,
1023,2022-01-04 13:40:29,1478360690310082561,I saw m7 take astrazeneca hw come he i,891039428,0,"Kampala, Uganda",Neutral,
1024,2022-01-04 13:40:22,1478360661411483658,Only for sinovac and astrazeneca Pfizer and Moderna have show no such risk,39067799,0,"Mount Pleasant East, Toronto",Neutral,
1025,2022-01-04 13:40:06,1478360590565400579,Keep AZ in the vaccine mix well for T cell protection,20052899,0,"London, England",Neutral,
1026,2022-01-04 13:39:17,1478360387867320325,As long a we re share anecdote I ve only be to one funeral during Covid My friend s,213896226,0,,Highly_Negative,
1027,2022-01-04 13:39:08,1478360348986122249,No knighthood for you then then again you don t deserve one or any other r,19825835,0,,Highly_Negative,
1028,2022-01-04 13:36:30,1478359685296230405,,1349149096909668363,0,,Neutral,
1029,2022-01-04 13:36:16,1478359626072662022,Why be Britain no longer use it I m go with the sherbet dip booster,705414726101114880,0,,Neutral,
1030,2022-01-04 13:35:51,1478359521999339521,Not by the like of you,1415281905226948609,0,EU,Neutral,
1031,2022-01-04 13:35:44,1478359491947245576,Huh Andy there be one of the Key figure in the AstraZeneca vaccine development Is that mention,80419148,0,Germany,Neutral,
1032,2022-01-04 13:34:20,1478359143148752898,Didn t the 3rd dose will come form Coz I be take the first and second same do,62465691,0,,Weakly_Positive,
1033,2022-01-04 13:34:20,1478359139705397251,AstraZeneca vax How long ago Take care,1405529439757213697,0,United States,Highly_Negative,
1034,2022-01-04 13:33:14,1478358865544720391,Please sit down and be quiet Hancock You partied while people be die a,19825835,0,"South East London, England",Highly_Negative,
1035,2022-01-04 13:32:28,1478358672329818113,What s the late on please,20052899,0,Cardiff ,Highly_Negative,
1036,2022-01-04 13:31:17,1478358373921964037,Bet you still fill your pocket,19825835,0,Brighton,Neutral,
1037,2022-01-04 13:30:42,1478358225745588229,We know this Cocky As usual you be not tell u anything new Please sto,19825835,0,Devon UK,Highly_Negative,
1038,2022-01-04 13:30:08,1478358085139849223,Matt a the ORIGINAL DeathSecretary you blow all your remain credibili,19825835,0,,Weakly_Positive,
1039,2022-01-04 13:29:49,1478358006349897730,You still here,19825835,0,,Neutral,
1040,2022-01-04 13:29:21,1478357887902797828,WOW Can you just remind me the death rate Covid in the UK You know,1944466748,0,"Seaham, England",Weakly_Positive,
1041,2022-01-04 13:28:52,1478357767463317505,Be go with you You have your time and hopefully you will be an unimportant footnote in history,19825835,0,,Highly_Negative,
1042,2022-01-04 13:28:30,1478357671891947523,Javid you be a disgrace you have abandon any form of responsibility exce,20052899,0,,Neutral,
1043,2022-01-04 13:25:50,1478357003013611523,We have decide to suspend the use of AstraZeneca a,1470599369011433475,0,"New York, NY",Neutral,
1044,2022-01-04 13:25:38,1478356951025205256,By the time he take his first shot country have AstraZeneca in stock may,951012255646322688,1,kampala,Weakly_Positive,
1045,2022-01-04 13:25:15,1478356854573092870,Bravo X,1198652670267056128,1,Over by there.,Neutral,
1046,2022-01-04 13:24:50,1478356751586054173,Nearly one year ago you be have a wine and cheese party in lockdown bet,19825835,0,somewhere,Weakly_Positive,
1047,2022-01-04 13:24:01,1478356545146658818,Fanny,19825835,0,"𝙻𝙸𝚅𝙴𝚁𝙿𝙾𝙾𝙻, 𝙴𝚄.",Neutral,
1048,2022-01-04 13:22:24,1478356139477975044,Andrew Pollard one of the creator of the Oxford AstraZeneca Covid 19 vaccine have say that give people booster shot,297902210,2,Pasay City,Neutral,
1049,2022-01-04 13:22:23,1478356134897590275,I think the President s first two shot be administer with the AstraZene,285577145,0,"Kampala, Uganda",Weakly_Positive,
1050,2022-01-04 13:21:40,1478355955003838467,Creators of the Oxford AstraZeneca vaccine say give people booster twice a year be not sustainable,3332580784,0,"Hoima,  Uganda ",Neutral,
1051,2022-01-04 13:21:36,1478355935240273920,,1337042700491743236,48,,Neutral,
1052,2022-01-04 13:21:27,1478355897965551616,COVID 19 Worst of the pandemic be absolutely behind u say scientist behi,1243986311394086914,0,"Dublin, Ireland",Weakly_Negative,
1053,2022-01-04 13:19:36,1478355431911309312,Don t forget to mention the 170 000 death,19825835,0,,Neutral,
1054,2022-01-04 13:19:27,1478355393575325696,Give your mistress a hug why don t you it s OK now,19825835,0,"I am here, except when I'm not",Highly_Positive,
1055,2022-01-04 13:18:47,1478355227904466944,OBE for Cambridge Covid 19 research scientist Dr Ruth March senior VP R amp D and an advisory panel memb,62465691,0,"Cambridge, UK",Neutral,
1056,2022-01-04 13:17:28,1478354895715586048,Humans have achieve herd immunity agains,1392617959810535424,0,,Neutral,
1057,2022-01-04 13:16:48,1478354728237121538,Read the full interview with Professor Sir Andrew Pollard here,16343974,4,London,Weakly_Positive,
1058,2022-01-04 13:16:05,1478354546422390788,By the time he take his first shot country have AstraZeneca in sto,285577145,1,"Kampala, Uganda",Weakly_Positive,
1059,2022-01-04 13:15:46,1478354470157406208,Yes it need to be administer intravenously not apply like a topi,1944466748,0,Airstrip One,Neutral,
1060,2022-01-04 13:15:00,1478354277844332547,Surely the UK be do it bit,153810216,0,,Highly_Positive,
1061,2022-01-04 13:14:56,1478354257879392259,Well at lea,1332300949000478722,0,Manchester,Neutral,
1062,2022-01-04 13:14:42,1478354201059250177,I didn t know it be a race doesn t really matter who be first but you do,20052899,0,,Weakly_Positive,
1063,2022-01-04 13:13:41,1478353943889518594,first dose slight din sa braso 2nd dose walang symptom AstraZeneca,1443062493153091587,0,,Weakly_Positive,
1064,2022-01-04 13:13:25,1478353875996491779,He cost plenty in France too,1944466748,0,"Birmingham, England",Neutral,
1065,2022-01-04 13:13:07,1478353799815340033,CEO be right World vaccination need to be a global effort lead by the wealthy country individu,62465691,0,,Weakly_Positive,
1066,2022-01-04 13:12:11,1478353566108688388,And 12 month later we re still refuse to have it or any others We re not,20052899,0,"peaceful,rural Bulgaria.",Neutral,
1067,2022-01-04 13:11:51,1478353482193285126,True,1263857382708264962,0,"San Francisco, CA",Weakly_Positive,
1068,2022-01-04 13:10:56,1478353250835329027,Congratulations,48289662,0,,Neutral,
1069,2022-01-04 13:10:52,1478353236822269964,Blood clot a prevalent with Pfizer and Moderna vaccine a with AstraZeneca s study A friend of mine after few day of,760732579528073216,18,"B/W Venus, Mercury & Jupiter",Highly_Negative,
1070,2022-01-04 13:10:23,1478353113673256967,Shameful that et Al bad mouth it Blood on their hand,20052899,0,uk,Weakly_Negative,
1071,2022-01-04 13:10:06,1478353042214993923,The behavior of toward and roxadustat be,3033312656,0,Watching the fda fuck biotech,Neutral,
1072,2022-01-04 13:08:53,1478352737775632384,One year ago today you be line your pocket and those of your mate down,19825835,0,"England, United Kingdom",Highly_Negative,
1073,2022-01-04 13:08:44,1478352699393466369,You spend too much time boost your ego and the collective ego of the gover,20052899,0,North West England,Weakly_Positive,
1074,2022-01-04 13:08:04,1478352531713667072,Clinical Oncology Research Training Fellowships by and provide industry experience,14617444,2,"Nashville, TN",Neutral,
1075,2022-01-04 13:07:40,1478352432392507397,Don t look into astrazeneca You win t like it,712552463174393856,0,NYC,Highly_Positive,
1076,2022-01-04 13:07:03,1478352273965461511,Yup Let s all pretend a certain party didn t have campaign against AstraZeneca and Med,14277012,0,Republic of Taiwan,Weakly_Positive,
1077,2022-01-04 13:05:12,1478351810066796546,why Pfizer this time round yet he get ast,891039428,0,Uganda,Highly_Negative,
1078,2022-01-04 13:03:33,1478351394373525506,Thank you it just need to end now honesty need to prevail about,1255527235,1,,Neutral,
1079,2022-01-04 13:02:27,1478351117880758274,Was my AstraZeneca vaccination moral I could have die from TTS,384021812,0,"Sydney, Aust, Bidjigal land",Neutral,
1080,2022-01-04 13:02:15,1478351068690059268,Poverty and h,20254129,0,England ,Neutral,
1081,2022-01-04 13:02:09,1478351042098053120,The mRNA jab be Moderna and Pfizer The rest include Covishield AstraZeneca be adenovirus vaxx,258283931,0,Itinerant ,Neutral,
1082,2022-01-04 13:01:05,1478350775223005189,On This Day In History January 4th 2021 1st Oxford AstraZeneca Covid 19 vaccine give to general public,153059185,1,History,Weakly_Positive,
1083,2022-01-04 13:00:56,1478350736379777025,I win t pay to read this article Not prepared to subscribe to any newspaper simply to read one or two decent art,19437080,1,,Weakly_Positive,
1084,2022-01-04 13:00:36,1478350649855070208,You fail to mention how many it have kill and how many it have injure Doesn,20052899,0,"London, England",Weakly_Positive,
1085,2022-01-04 12:59:57,1478350490341683200,Well do to all involve,19825835,0,UK & USA,Neutral,
1086,2022-01-04 12:59:53,1478350473069481986,I think you will find I be respond,1439931399864295430,0,Beverley,Neutral,
1087,2022-01-04 12:58:52,1478350217581838341,So be you say it fine to do what,1439931399864295430,0,Beverley,Weakly_Positive,
1088,2022-01-04 12:54:57,1478349229701615623,I think most people be I ve have the first 2 AstraZeneca I m not willing to risk more lu,1431227950297456650,0,"England, United Kingdom",Weakly_Positive,
1089,2022-01-04 12:54:51,1478349204632354817,Love affair,19825835,0,Londres and Sao Paulo ,Highly_Positive,
1090,2022-01-04 12:54:30,1478349116333858821,Truly true,285310635,0,Londres and Sao Paulo ,Weakly_Positive,
1091,2022-01-04 12:54:10,1478349034838441985,Everything good that this country do be when have nothing to do with,1213606122587750406,1,Uk,Highly_Positive,
1092,2022-01-04 12:53:14,1478348797864554498,How many have die because of mismanagement Typical conservative bragging ab,20052899,0,Uk,Weakly_Positive,
1093,2022-01-04 12:52:43,1478348667245543427,Africa be do quite fine People be take herbal remedy and bui,1944466748,0,,Weakly_Positive,
1094,2022-01-04 12:51:01,1478348239489355776,And still we can t have freedom to do a we want without you twitter and t,20052899,0,,Neutral,
1095,2022-01-04 12:50:11,1478348029115654144,Everything good that this country do be when have nothing t,20052899,1,Here and there ,Highly_Positive,
1096,2022-01-04 12:49:44,1478347917303947265,I win t pay to read this article Not prepared to subscribe to any newspaper simply to read one or two d,16343974,1,On the lav,Weakly_Positive,
1097,2022-01-04 12:44:55,1478346705120919555,You can find the data online in open access paper NEJM a,767115782648164353,0,England ,Neutral,
1098,2022-01-04 12:42:49,1478346178634805251,Hello Can Covishield AstraZeneca be take a a booster dose to fight Omicron for those who have,1293113010941296640,0,India,Neutral,
1099,2022-01-04 12:40:39,1478345633283067905,,1349149096909668363,0,,Neutral,
1100,2022-01-04 12:40:22,1478345560239263745,Because you re saint,1415281905226948609,0,Bandit country,Neutral,
1101,2022-01-04 12:40:09,1478345505126158342,It s highly likely that people become seriously ill and die of Covid because of vaccine misinformation Professor Andre,18364723,1,In the kitchen,Highly_Negative,
1102,2022-01-04 12:39:48,1478345415485538305,Are you constipate be so full of sarcasm,173168162,0,,Weakly_Positive,
1103,2022-01-04 12:38:48,1478345165756579841,Without the vaccine be available to,173168162,0,,Weakly_Positive,
1104,2022-01-04 12:38:42,1478345139986829316,The comment from Sir Andrew about Macron and Merkel s Astrazeneca disinformation be interest I ve fel,159992511,0,East Midlands. UK,Neutral,
1105,2022-01-04 12:38:08,1478344998336749577,COVID 19 Worst of the pandemic be absolutely behind u say scientist behind Oxford AstraZeneca vaccine,4603671503,1,,Weakly_Negative,
1106,2022-01-04 12:36:14,1478344521226375168,That s only the Moderna and Pfizer Astrazeneca be just a behringer knock off,320285141,0,,Neutral,
1107,2022-01-04 12:34:59,1478344204136943619,Medium to long term effect Investigation into vaccine damage,20052899,0,,Highly_Negative,
1108,2022-01-04 12:34:17,1478344030757040131,So be it OK to send a dangerous British vaccine to the B,92804452,0,,Highly_Negative,
1109,2022-01-04 12:33:00,1478343704163332102,Have you see this petition yet,48289662,0,"England, United Kingdom",Neutral,
1110,2022-01-04 12:32:09,1478343491608526850,And yet people be still die even though they have have vaccine and booster,20052899,0,,Neutral,
1111,2022-01-04 12:32:07,1478343484100816902,lifetothefullest I HAVE NOTICED A NUMBER OF PEOPLE IN THE AGE 12 18 1,360054369,0,"Stratford, Ontario, CANADA",Neutral,
1112,2022-01-04 12:31:56,1478343436692566016,Before May 2022 Cart before Horse,1332300949000478722,0,Manchester,Neutral,
1113,2022-01-04 12:31:40,1478343372674940937,amp hop this Covid 19 ordeal be soon go to be over Love amp light be all we need right now COVID 19 Worst of the pan,18549671,1,United Kingdom,Weakly_Positive,
1114,2022-01-04 12:31:33,1478343341309935619,This be what I receive from AstraZeneca yesterday,205833362,0,,Neutral,
1115,2022-01-04 12:28:00,1478342448539701257,Mr Macron should be congratulate for prevent the Af,2196184184,0,,Neutral,
1116,2022-01-04 12:27:41,1478342368893960201,Perspective all sound a little panicky this morning on air AZN Astrazeneca,404422077,0,London.,Weakly_Positive,
1117,2022-01-04 12:26:43,1478342126161338368,A Covid vaccine booster aim at tackle multiple variant show promise in induce a comprehensive immune response early data s,19983221,1,Bruxelles-sur-Senne 🇧🇪 🇪🇺,Weakly_Positive,
1118,2022-01-04 12:25:27,1478341806706331655,Vaccinations alone aren t enough They need to be combine without other publ,20052899,0,,Highly_Negative,
1119,2022-01-04 12:22:47,1478341136855052288,And you be claim credit for it for what reason Until 2020 Jan the 1st no,20052899,0,"London, Ruse,  Burgas. ",Neutral,
1120,2022-01-04 12:22:10,1478340981560913921,How long do it take for people vaccinate with first dose Astrazeneca to have second one,452850112,0,,Weakly_Positive,
1121,2022-01-04 12:21:48,1478340889609228289,Sovereignty be indeed wonderful,1944466748,0,London,Highly_Positive,
1122,2022-01-04 12:20:18,1478340511094263808,Such an achievement from and and a fantastic examp,20052899,0,London,Weakly_Positive,
1123,2022-01-04 12:20:15,1478340496015691778,I ve have all 3 of mine but can you guarantee any long term affect they have,707554329511772160,1,,Highly_Negative,
1124,2022-01-04 12:20:09,1478340473941078018,I ve have all 3 of mine but can you guarantee any long term affect they hav,19825835,1,,Highly_Negative,
1125,2022-01-04 12:19:54,1478340409055195158,You re the best health minister ever thank you sajid javid,20052899,0,,Highly_Positive,
1126,2022-01-04 12:17:24,1478339780790390791,2 The program be support by educational grant from AstraZeneca Bayer Boehringer Ingelheim Pharm,1327271529181274114,1,,Weakly_Positive,
1127,2022-01-04 12:17:15,1478339742022385673,So why be you so useless at vaccinate u18s Childism,1240469648996433923,1,Outer space,Weakly_Negative,
1128,2022-01-04 12:17:04,1478339695016878085,Capitalism and it rivalry be warfare the source be rival BigPharma not France,1944466748,0,South Wales,Neutral,
1129,2022-01-04 12:16:05,1478339450153357314,Poverty and hardship kill more,897902359,0,Manchester,Highly_Positive,
1130,2022-01-04 12:11:01,1478338173189111809,Cambridgeshire should benefit from level up as much a the North it s after all level up the whol,365904677,0,United Kingdom,Weakly_Positive,
1131,2022-01-04 12:10:06,1478337942946996230,Are you mad Why give a vaccination to a child that doesn t effe,418169907,0,,Weakly_Negative,
1132,2022-01-04 12:09:00,1478337668140638212,What happen to 15m jab to freedom,20052899,0,,Neutral,
1133,2022-01-04 12:07:12,1478337214664818689,Eerily accurate,1198652670267056128,0,London - Citizen of the world,Weakly_Positive,
1134,2022-01-04 12:06:06,1478336934749560832,So why be you so useless at vaccinate u18s Childism,20052899,1,,Weakly_Negative,
1135,2022-01-04 12:05:29,1478336780738957324,Good afternoon Matt and congratulation I don t know what the country would,19825835,19,Royston Vasey.,Highly_Positive,
1136,2022-01-04 12:05:07,1478336688917295104,Thank you for that information An excellent achievement,20052899,0,"England, United Kingdom",Highly_Positive,
1137,2022-01-04 12:04:29,1478336527642025992,Utter twaddle,20052899,0,,Neutral,
1138,2022-01-04 12:02:25,1478336010966781953,But the British Oxford vaccine be not very effective and,1461556525877678086,0,,Highly_Negative,
1139,2022-01-04 12:01:40,1478335821904285703,Quick go and tell Astrazeneca because that s a snapshot of their website Lol we really,1338541393246097408,0,,Weakly_Positive,
1140,2022-01-04 12:00:57,1478335639447875588,The EU shun the use of AstraZeneca because it be British AstraZeneca CEO say it Covid jab may have help the UK,555370896,321,Bath,Neutral,
1141,2022-01-04 12:00:02,1478335409973346307,I think the more interesting comment be misinformation about the Astrazeneca vaccine especially,403459590,1,East Midlands. UK,Weakly_Positive,
1142,2022-01-04 11:58:39,1478335063444135939,Today mark 1 year since NHS deployment of the Oxford University AstraZeneca COVID19 vaccine which be trialled in We,3305452091,1,"Southampton, England",Neutral,
1143,2022-01-04 11:57:19,1478334727585206273,COVID 19 Worst of the pandemic be absolutely behind u say scientist behind Oxford AstraZeneca vaccine,1472601280157786119,1,,Weakly_Negative,
1144,2022-01-04 11:57:07,1478334675651371009,Before you take this crap check out the yellow card system on gov website,19825835,0,"Santa Cruz de Tenerife, Spain",Highly_Negative,
1145,2022-01-04 11:56:41,1478334567672995841,Hello all we have a fully fund PhD project in collaboration with to study ubiquitin ligase and DNA replicati,2370107870,48,Amphoe Mueang Chiang Mai,Neutral,
1146,2022-01-04 11:54:45,1478334082270601219,You need to talk to your care provider and discuss your access to social medium,999854035,0,"London, England",Weakly_Positive,
1147,2022-01-04 11:54:23,1478333987227639811,Indeed you sound like you be educate far beyond your own intelligence,1854347322,0,,Weakly_Positive,
1148,2022-01-04 11:53:18,1478333713318563843,AstraZeneca don t have a booster only Pfizer so that s what they re give to everyone,89441744,0,"London, England",Neutral,
1149,2022-01-04 11:51:27,1478333249562710021,Thinking of you A real person with a real life experience I have AstraZenec,29447428,28,"Calgary, Alberta",Weakly_Positive,
1150,2022-01-04 11:50:04,1478332903075500033,Not sure who you vote fo,897902359,0,Manchester,Highly_Negative,
1151,2022-01-04 11:49:29,1478332752856592391,You mean the great British Oxford vaccine that be once hail a the s,1944466748,0,,Weakly_Positive,
1152,2022-01-04 11:49:21,1478332721579671557,Let s not talk about how many live the Tories have cost over here,1944466748,0,Scouser exiled in Devon,Weakly_Positive,
1153,2022-01-04 11:47:52,1478332349385424896,Get over it you knob Colin Barber,285310635,0,,Neutral,
1154,2022-01-04 11:47:17,1478332201892823041,Blimey be you his mum,1439931399864295430,0,Beverley,Neutral,
1155,2022-01-04 11:46:47,1478332077321900032,Are you say with the vaccine he eo,1439931399864295430,0,Beverley,Neutral,
1156,2022-01-04 11:46:32,1478332012775755780,Thank you Matt We need you back a health secretary They be throw u t,19825835,0,,Neutral,
1157,2022-01-04 11:45:54,1478331852566011905,You re still alive though,1444797517,0,,Weakly_Positive,
