,DateTime,Tweet_Id,Tweet,User_Id,Retweet,Location,Label,Country
1120,2022-01-09 09:00:12,1480102091834028032,This be obscene Last week 8 investor in Pfizer and Moderna become 10 billion richer a news about the Omicron variant s,29442313,15549,"Madurai Tamil Nadu, UnionIndia",Neutral,
1121,2022-01-09 09:00:05,1480102062595575808,Ontario saw 86 stillbirth in 6 mo s all jab the norm be 6 to 7 a yr dr Nagase mention this,253872062,0,,Neutral,
1122,2022-01-09 08:59:34,1480101933859983360,completely different vaccine those use dead variant of live virus mRNA one,1274584469530456064,0,UK Based,Highly_Negative,
1123,2022-01-09 08:59:23,1480101887198121984,Check out Herman Cain award Interesting thread on Reddit,319618170,0,"Mesa, AZ",Highly_Positive,
1124,2022-01-09 08:59:21,1480101878243471360,Who have update their reconmendations here on the 5th of January which still state that only child,21568831,0,"Co. Louth, Ireland",Neutral,
1125,2022-01-09 08:59:12,1480101841568468994,Pfizer and Moderna charge the US government 24 26 a vaccine Pakistan Bangladesh Vietnam and Indonesia be large market,1281203784484610048,4,,Weakly_Positive,
1126,2022-01-09 08:58:58,1480101783448006659,Imagine if Pfizer announce that they have a new vaccine and it be pretty good but it would k,56898796,60,Texas,Weakly_Positive,
1127,2022-01-09 08:58:57,1480101776250392578,They have order from other country who actually give a RATs about the future Same with Vaccines wh,1067015785476907008,0,"Melbourne, Victoria",Highly_Negative,
1128,2022-01-09 08:58:39,1480101701134729218,This Tweet be sponsor by Pfizer,1316479641448841216,0,,Neutral,
1129,2022-01-09 08:58:29,1480101661313880068,Oh ignore the Chinese Russian bot make up story Don t you look at VAERS da,319618170,0,"Mesa, AZ",Neutral,
1130,2022-01-09 08:58:19,1480101617567469574,Kids have more side effect from vaccine than COVID There s zero reason to vaccinate kid unless th,593289567,0,"Philadelphia, PA",Highly_Positive,
1131,2022-01-09 08:58:09,1480101577545457665,complicit in this profiteering racket along with,1475824558989053953,0,,Neutral,
1132,2022-01-09 08:58:02,1480101547023470594,It s a goddamn question Good God y all,1199463822773424128,0,My Chambers,Highly_Positive,
1133,2022-01-09 08:58:00,1480101539511476226,Be wary TrustNoOne,331259225,1,London,Weakly_Negative,
1134,2022-01-09 08:57:51,1480101500248600577,Pfizer be laugh all the way to the bank,42371615,0," Faversham, Kent ",Weakly_Positive,
1135,2022-01-09 08:57:33,1480101425719955464,,902286768,47,,Neutral,
1136,2022-01-09 08:57:32,1480101421164871682,Reuters Chairman be Pfizer Investor and Board Member,422433372,0,,Neutral,
1137,2022-01-09 08:57:20,1480101373051953152,Do you know why your vaccine cause heart problem You can deny it but the truth will come out can you,56488059,0,,Neutral,
1138,2022-01-09 08:56:53,1480101258698571777,I sense it s all unravelling maybe Now Pfizer data have to be disclose by FDA could be nuclear,1379046690829828098,0,"Wales, United Kingdom",Neutral,
1139,2022-01-09 08:56:27,1480101150179405825,All 3 of the Pfizer jab cause 24 48hrs of dead arm aching soreness at site of jab for me Comp,1378115873337118722,0,,Highly_Negative,
1140,2022-01-09 08:56:16,1480101102221619200,do u get AZ again or Pfizer,2729815242,0,chrissy x 2 | AR57 Asia,Neutral,
1141,2022-01-09 08:55:56,1480101018235031554,Yeah mine be just like yours I get astra at first and then Pfizer for my booster my flat mate have get,1066380996734443520,0,Red season,Weakly_Positive,
1142,2022-01-09 08:55:45,1480100973502734339,He be NEVER the CSO of Pfizer,924541717944131584,0,Dennison Barracks,Neutral,
1143,2022-01-09 08:55:38,1480100943811125253,Not really a fact He leave Pfizer 11 year ago and never work with vaccine He s just lo,3081320277,0,,Highly_Negative,
1144,2022-01-09 08:55:34,1480100927889494016,Everyone keep act like vaccine be to prevent a virus that s not what there for people They re so b,15593696,0,,Neutral,
1145,2022-01-09 08:55:12,1480100833295572992,Pfizer snuck vaccine in the pill,740244738738126849,0,,Neutral,
1146,2022-01-09 08:54:50,1480100740119019523,Covid schmovid PFIZER SCHIZER,1368595763350081542,0,,Neutral,
1147,2022-01-09 08:54:37,1480100688868880384,Yes ker ching Do either of you have Shares in Pfizer AstraZeneca or Moderna Bet y,3131144855,0,West Midlands,Neutral,
1148,2022-01-09 08:54:20,1480100616433250312,you can t get true number of adverse effect when they refuse to do autop,27514116,0,"Brandon, Fl",Weakly_Positive,
1149,2022-01-09 08:54:08,1480100565514596352,Hello I m not a vaccinologist but literature say that there s no contraindication naman for Astra,297846000,0,,Neutral,
1150,2022-01-09 08:54:04,1480100548741414912,Vaccinators charge in murder case of innocent child Ernest Ramirez spend his Christmas at his son grave grieve Hi,1454950943523549185,496,,Highly_Positive,
1151,2022-01-09 08:53:38,1480100439295238148,and Pfizer vaccine 3rd dose not 1st and 2nd link to effect on none covid19 relate,1451328659416129538,0,UK Based,Neutral,
1152,2022-01-09 08:53:32,1480100416079597570,That s primarily a function of time the first U S EUA for Pfizer be in December of 2020 less than,18433550,0,"San Diego, California",Weakly_Positive,
1153,2022-01-09 08:53:19,1480100361411063811,And you will kill and damage many child with this shot,2341433004,0,,Highly_Positive,
1154,2022-01-09 08:53:15,1480100343757348870,He didn t sell out Brazil to Pfizer like Australia do VivalaBrasila,868304334085275648,5,,Neutral,
1155,2022-01-09 08:53:10,1480100323435986952,He amp 20 other country indica,1323988009935609857,0,United States,Highly_Negative,
1156,2022-01-09 08:52:39,1480100192565313536,Our Market Place Shopping Centre clinic be open today from 8 30am 6pm For everyone age 12 Pfizer and Astra Zeneca va,4297938873,7,Bolton,Neutral,
1157,2022-01-09 08:52:10,1480100071693856769,How can you trust what Big Pharma tell you when you know they re in it for money,1168633894817677317,0,Somewhere.. ,Neutral,
1158,2022-01-09 08:52:09,1480100067306475520,I be 13 and over the course of my entire childhood not one vaccination cause a sid,1278199666174095360,0,'Straya,Neutral,
1159,2022-01-09 08:52:07,1480100056376266752,Yep This be announce a while back And be the catalyst for FedGov to actually approve GPs and,1426408705294094337,0,Australia,Neutral,
1160,2022-01-09 08:52:03,1480100043067695105,So be we suppose to trust Pfizer now,1298372735383605249,0,"Ashbourne, UK",Neutral,
1161,2022-01-09 08:51:29,1480099901073952768,I keep AZ in stock and give people the choice Independent data doesn t support high efficacy for Pfizer tho,1138944049635708928,1,,Weakly_Positive,
1162,2022-01-09 08:51:23,1480099875559723016,Did I say they d receive full approval for age 5 12 No I do not,1422234333771862017,0,,Weakly_Positive,
1163,2022-01-09 08:51:17,1480099847919316998,Once the Graphene Oxide Hydroxide in the vaxxines get inside the body there be no way out Damag,1344189631428870146,1,India,Neutral,
1164,2022-01-09 08:51:15,1480099838792396801,Asset manager pension fund and insurance company ask Pfizer Johnson amp Johnson Moderna and AstraZeneca to adopt,330826792,2,"Cotabato City, Philippines",Neutral,
1165,2022-01-09 08:50:58,1480099768701526020,Since AP Reuters be do push back on MassPsychosis now seem to be a good time to remind people of,18208354,0,,Weakly_Positive,
1166,2022-01-09 08:50:57,1480099763265572864,Sounds like the Pfizer check clear,3010738968,0,,Weakly_Positive,
1167,2022-01-09 08:50:34,1480099670269517829,2 Moderna jab Wirth Pfizer booster And 1 French toast 2 waffle Not an fan of pancake,14247236,0,,Neutral,
1168,2022-01-09 08:50:32,1480099660677140482,Thanks for your answer My adult son amp I be fully vaccinate in early 2021 amp wear mask but h,1019263444346863616,0,"Sunrise, FL",Weakly_Positive,
1169,2022-01-09 08:50:27,1480099638690545665,Note the word former And no he doesn t,1408796406031155202,0,,Neutral,
1170,2022-01-09 08:50:09,1480099565239869440,Like you he have previously have two dos of Pfizer,1398513148181630978,0,"Melbourne, Victoria. ",Highly_Negative,
1171,2022-01-09 08:49:42,1480099450194333697,Not Taking side some fourth vaccine start in UK Europe depend when you start Only know of Pfizer,1449983749894987783,0,,Neutral,
1172,2022-01-09 08:49:35,1480099421819965442,The CDC be nothing more than another marketing arm of Pfizer How could anyone still take them seriously,2308596938,0,"Toronto, Ontario",Weakly_Positive,
1173,2022-01-09 08:49:29,1480099394066292736,It horrific amp Its not be report a Its all brush under the carpet to appease Pfizer,1470071744966889479,2,Planet Earth,Weakly_Negative,
1174,2022-01-09 08:49:04,1480099292551561218,However we should offer a choice in the type of vaccine offer many vaccine on the global market be n,16618294,0,"Geneva, Switzerland",Weakly_Positive,
1175,2022-01-09 08:48:41,1480099193922461699,and Any comment,1652541,0,Traveling,Neutral,
1176,2022-01-09 08:48:39,1480099186238373890,I keep AZ in stock and give people the choice Independent data doesn t support high efficacy for,74349953,1,https://mobile.twitter.com/sal,Weakly_Positive,
1177,2022-01-09 08:48:38,1480099183591837699,Fact check Steve James C Smith retire from his TRC positiond in February of 2020,3092261302,0,,Neutral,
1178,2022-01-09 08:48:32,1480099155687391232,Dr Gabriel Leung HK govt advisor accuse Pfizer BioNTech doesn t provide result of COVID 19 vaccine,1339488762,0,France,Neutral,
1179,2022-01-09 08:48:28,1480099139559985154,School be compulsory mask aren t And just far delay the Modern,330219717,5,"Louisville, CO",Weakly_Positive,
1180,2022-01-09 08:48:22,1480099112661831680,Tens of thousand of people be suffer serious adverse reaction to the Pfizer drug heart attack stro,847852419535032320,19,,Highly_Negative,
1181,2022-01-09 08:48:07,1480099050913353729,It take about 2 week after my Pfizer before they disappear,1429035744736137219,0,"Sydney, Australia",Neutral,
1182,2022-01-09 08:47:56,1480099004662759425,Sigh The connection be pfizer Join the dot,1371597907426615297,0,,Neutral,
1183,2022-01-09 08:47:36,1480098921972174849,Putting out fire with gasoline Franklin Which erectile product do you use Pfizer,1127715169658920960,0,North Carolina,Neutral,
1184,2022-01-09 08:47:17,1480098840246054912,Im gettin close to my 4mth date on 19th Feels just the same a sq one Self impose LD Feel vunerab,1599912847,0,"Melbourne, Victoria",Neutral,
1185,2022-01-09 08:47:08,1480098806238789635,This lady just lose her mum and you want evidance Wait a few m,4752662501,0,london,Highly_Negative,
1186,2022-01-09 08:47:04,1480098788140322816,Got my booster Moderna on top of two Pfizer BioNTech Feel extremely fortunate and grateful to everyone who have make,14513581,1,Barcelona,Weakly_Positive,
1187,2022-01-09 08:47:03,1480098784835108866,Wish I could say the same Just have my Pfizer booster after 2 x AZ and my stubborn hand wart be get big again,14093751,0,,Neutral,
1188,2022-01-09 08:46:36,1480098670259458048,I have have 3 dos of Pfizer and recently discover this below If you watch this video summary yo,18397585,2,"East, Where sheep are worried.",Neutral,
1189,2022-01-09 08:46:34,1480098661363290113,I m ask honestly a it be hard to get a clear answer on this Above be my situation an,711684048,0,"Glasgow, UK",Highly_Negative,
1190,2022-01-09 08:46:28,1480098635731935238,If you can trust Pfizer s little blue pill why can t you trust their vaccine,1413332343725514754,0,,Highly_Negative,
1191,2022-01-09 08:46:21,1480098608661864448,Unless you live on Wallis and Futuna,1272659296866594816,0,New Jersey + Obama's Street,Weakly_Positive,
1192,2022-01-09 08:46:04,1480098537773826049,Safe unless like my wife you develop pericarditis and arythmia no one want to talk,40778270,0,,Highly_Positive,
1193,2022-01-09 08:45:38,1480098426629107712,EVERY patient who be fly be BECAUSE of COVID EVERY patient be on a ventila,4884088424,0,New Jersey + Obama's Street,Highly_Positive,
1194,2022-01-09 08:45:31,1480098396190826499,Two different people Though technically Pfizer isn t own by anyone The company,942181527823171589,0,,Weakly_Positive,
1195,2022-01-09 08:45:27,1480098380026101761,I dare them to put THANK YOU PFIZER on their window,2785680441,4,"51.444487135165055, -0.5660179",Neutral,
1196,2022-01-09 08:45:16,1480098334404595713,Or the OTHER pill from Pfizer specifically to treat COVID,3373615943,0,,Highly_Negative,
1197,2022-01-09 08:45:09,1480098307196260354,This be what Pfizer will plan on give them,821721972249948160,27,,Neutral,
1198,2022-01-09 08:44:58,1480098257539764224,Which one be experimental The pfizer and moderna that have be in product,303037252,0,Perth,Weakly_Positive,
1199,2022-01-09 08:44:53,1480098236186644484,Why would Pfizer want to hide the data for 75 year to begin with Wake up people,824392416493010944,1,,Neutral,
1200,2022-01-09 08:44:36,1480098166334701572,Full interview of last night s interview ex chief scientist at Pfizer Dr Mike Yeadon Why asymptomatic spread be nonsens,1282739148701470720,1,,Weakly_Positive,
1201,2022-01-09 08:44:19,1480098095199313924,Why do so many people claim amp actually believe Mike Yeadon be Vice President of Pfizer In reality he be VP of Pfi,2813049204,6,,Weakly_Positive,
1202,2022-01-09 08:44:04,1480098032171597826,CNN Gives Award to Pfizer CEO for fund lie via,15793787,1,Texas,Neutral,
1203,2022-01-09 08:43:35,1480097911266545664,I also believe in lockdowns no covid and in the vaccine until I saw how th,1080472681684844544,0,,Neutral,
1204,2022-01-09 08:43:32,1480097896389234690,One shot Moderna be more than primary series booster Pfizer So not surprise haha Moderna for young ma,217370939,1,Western Australia,Weakly_Positive,
1205,2022-01-09 08:43:31,1480097896032833536,You move along in my post bother you Keep scroll amp keep your head bury in,1466671719456804864,0,East Anglia,Neutral,
1206,2022-01-09 08:43:13,1480097818723303426,Except we don t have the data to,1441406708409008131,0,"My House, Earth",Neutral,
1207,2022-01-09 08:42:59,1480097758744776706,Why stop at 3 jab crisis the Australia government have purchase 150 000 000 dos of Pfizer an,155914980,0,,Neutral,
1208,2022-01-09 08:42:54,1480097739467755521,However if you go and look at the Pfizer panel There be a warning of heart inflammation bei,1066266064995139584,0,"Tucson,Arizona",Neutral,
1209,2022-01-09 08:42:44,1480097697411465219,Dr B be this the study that you be look at If so what do yo,1385546269,1,Western Australia,Neutral,
1210,2022-01-09 08:42:37,1480097669208952832,Testing on healthy people be not guarantee to work on the target peo,1082807392591638533,0,,Highly_Positive,
1211,2022-01-09 08:42:25,1480097617954627584,All these symptom and disorder be list a side effect to the vaccine moderna and pfizer anywa,1348825664451866624,0,"Houston, TX",Neutral,
1212,2022-01-09 08:42:20,1480097595800244224,True they do build antibody with the Pfizer amp Moderna vaccine remain to be effective against seve,20651091,0,"California, USA",Weakly_Positive,
1213,2022-01-09 08:42:19,1480097593334063105,Thanks for ruin my health,146569971,0,Lenape land (NYC),Weakly_Positive,
1214,2022-01-09 08:42:15,1480097574753341440,Antibodies be train for the old variant It doesn t matter if you get 100 booster Won,2989443234,0,,Weakly_Positive,
1215,2022-01-09 08:42:06,1480097539521089538,Compared to car Pfizer vaccine be compare to Mercedes Benz Moderna to Rolls Royce,14260960,0,,Neutral,
1216,2022-01-09 08:42:06,1480097538980163585,The chairman of the boar,116398611,0,,Neutral,
1217,2022-01-09 08:42:02,1480097521615753218,BREAKING US FDA once again acknowledge the quickly wan efficacy of mRNA vaccine and reduces booster interval for,1293113010941296640,30,"centro,corazón Edo.de la Razon",Highly_Negative,
1218,2022-01-09 08:42:02,1480097519619084291,No offense but this be wrong Also it isn t right for anyone to judge if their information i,1066266064995139584,0,"Tucson,Arizona",Highly_Negative,
1219,2022-01-09 08:42:01,1480097517274427395,just pfizer i think,769479474572255232,0,"Melbourne, Australia",Neutral,
1220,2022-01-09 08:41:54,1480097488082116610,Could natural immunity be good than a vaccine,1094762324097822720,0,,Weakly_Positive,
1221,2022-01-09 08:41:46,1480097453625987072,La Quinta Columna have issue a new communiqu of special importance This time denounci,2777203403,0,,Weakly_Positive,
1222,2022-01-09 08:41:40,1480097428737081349,As I ve mention in previous post I ve have all 3 of mine Astra x2 wit,915530837046829057,0,At Home I think,Highly_Negative,
1223,2022-01-09 08:41:16,1480097328979603456,Judge Gives FDA 8 Months to Release Pfizer Vaccine Data After Agency Requested 75 Years,54769979,11,,Neutral,
1224,2022-01-09 08:41:04,1480097278098616321,I have have Covid 19 and one dose of pfizer vaccination and I have an EU pas issue in Italy In Italy o,37963496,0,,Neutral,
1225,2022-01-09 08:40:56,1480097244409860096,There be literally a pill for COVID ironically also from Pfizer,828583237886828545,0,,Neutral,
1226,2022-01-09 08:40:52,1480097228685705217,i get 2 dos of the pfizer vaccine the only side effect i experience be pain at the injection site,1386680018504400897,0,,Neutral,
1227,2022-01-09 08:40:39,1480097171483643905,This post be proudly sponsor by Moderna and Pfizer Global data show otherwise doc,831279407088148480,0,,Weakly_Positive,
1228,2022-01-09 08:40:18,1480097086452514818,I be vaccinate w vaccine b c I want to keep myself amp my fellow New Yorkers healthy I have an ad,146569971,0,Lenape land (NYC),Weakly_Positive,
1229,2022-01-09 08:40:14,1480097068215529472,Lies Be very careful what you believe it may cost you more than your life it could cost you you,80712889,0,,Weakly_Positive,
1230,2022-01-09 08:39:57,1480096998053322757,If the finding of these people be true and if these be genuine image from the content of a Pfizer vial other Big P,1448963269864136722,1,,Weakly_Positive,
1231,2022-01-09 08:38:37,1480096662081179648,No Both my father and aunt have MRIs shortly after shot booster and neither have have any related p,1438624378867048456,0,Canadian Prairies,Neutral,
1232,2022-01-09 08:38:26,1480096616853827591,Parents well start read,300521129,0,,Neutral,
1233,2022-01-09 08:38:07,1480096535656296448,This be important to note In fact one study find that previous COVID 19 be associate with increa,1262307733295861760,0,"Auckland, New Zealand",Weakly_Positive,
1234,2022-01-09 08:37:39,1480096418706735106,Experts bring to you by,18734379,0,,Neutral,
1235,2022-01-09 08:37:35,1480096402558439424,hi Sir I get both my parent pfizer booster administer 1 month back Is there a need for the seco,389313566,0,Karachi Pakistan,Neutral,
1236,2022-01-09 08:37:28,1480096372871233537,fussy about brand In fact for those of you hold out for a third pfizer you should know that there be study th,601539104,1,Canada,Neutral,
1237,2022-01-09 08:37:28,1480096371936051201,This could mean a double income stream for Pfizer the COVID vaccine and Viagara,1148974750921711617,2,"VA, USA",Highly_Negative,
1238,2022-01-09 08:37:21,1480096342382821377,You seriously need to do the tiny bit of research if you love your child Outside of MSM thi,363563158,0,,Weakly_Positive,
1239,2022-01-09 08:37:02,1480096264104595457,Quit give Pfizer money,965691112479514624,0,,Neutral,
1240,2022-01-09 08:36:59,1480096249499947010,do you know ceo till 2020 now chairman of reuter who be fact che,3699086606,1,"The Bay Area, California",Neutral,
1241,2022-01-09 08:36:14,1480096060026408962,You pay for the vax through your tax The government be charge a l,2327472013,0,"Niagara Park, Central Coast",Neutral,
1242,2022-01-09 08:36:11,1480096049691721730,If it make you feel good Sri lanka be let those who have 2 sputnik dos do 2 pfizer dos,3022960455,0,République de Maurice,Highly_Positive,
1243,2022-01-09 08:35:56,1480095985892470786,heard of Michael Yeadon Scientific Researcher ex Vice Pres of Pfizer 16 year a allergy and infec,723465296519020545,0,GOD BLESSED TEXAS WOMEN,Neutral,
1244,2022-01-09 08:35:52,1480095968053784576,The TV doctor that beacon of health who be a regular on breakfast TV Such a role model for Pfi,1463412066979516419,0,Australasia,Neutral,
1245,2022-01-09 08:35:50,1480095962144116744,look up the connection between Pfizer and Reuters Wake up people,1232003748886700032,0,,Neutral,
1246,2022-01-09 08:35:25,1480095856833429504,Do you know if they re do Pfizer and Moderna,136178955,0,"Melbourne, Victoria",Neutral,
1247,2022-01-09 08:35:13,1480095805004419073,The world of the carpet shuffle career politician with Pfizer share and a lifelong,1401010461080842245,0,"Brisbane, Queensland",Highly_Negative,
1248,2022-01-09 08:35:11,1480095797136052226,Surprise FDA Warns That Pfizer s Experimental Covid Pills Cause Life Threatening Reactions When Used with Many Common M,1366312526204567553,1,,Weakly_Positive,
1249,2022-01-09 08:35:08,1480095785194864646,Do your research before voice such offensive opinion E g who own Pfizer Is it a binary weapon Ag,261190133,0,,Weakly_Positive,
1250,2022-01-09 08:35:06,1480095774864150528,I hear on the news yesterday that people here be actually refuse booster when they hea,486332285,0,"Vancouver, unceded territories",Neutral,
1251,2022-01-09 08:34:55,1480095728467079170,Hi what be the registration link for 1st Dose Pfizer,32391821,0,,Neutral,
1252,2022-01-09 08:34:53,1480095721462378497,Hello I recently get Pfizer booster from MCV after get Sputnik 2 dose back in May 2021 Do I ne,1255758248948441088,0,,Neutral,
1253,2022-01-09 08:34:52,1480095717607686145,Apparently a dr from Pfizer itself tell how their govt be fool all along which get him fire no surprise Fyi th,781410138833891328,1,Aryavrat,Weakly_Positive,
1254,2022-01-09 08:34:40,1480095667896864771,8 Therefore both Comirnaty and the Pfizer BioNTech covid 19 vaccine,1422234333771862017,0,,Neutral,
1255,2022-01-09 08:34:12,1480095547885334529,Absolutely untrue He stand with me against a male that be attempti,994403396,0,,Weakly_Positive,
1256,2022-01-09 08:34:10,1480095542541701120,Made redundant because he bring nothing to the table now get a gru,1271309838,0,UK.,Highly_Negative,
1257,2022-01-09 08:33:54,1480095472765132800,Im so sorry I have personally try to warn people but they think im a conspiracy theorist This be heartbreaking,1050481544,0,The World,Highly_Negative,
1258,2022-01-09 08:33:22,1480095341043240961,Govt tell u do a LFT on day we come into close contact with others and that the test be reliable,13340732,0,,Neutral,
1259,2022-01-09 08:33:21,1480095337645707264,I wish your young child all the very best It be,980415148035751936,0,Australasia,Highly_Positive,
1260,2022-01-09 08:33:09,1480095286999535620,When the CEO of Reuters who be responsible for Twitter fact check be on the Board of Pfizer one have,175520540,1,Aethers,Weakly_Positive,
1261,2022-01-09 08:32:56,1480095232544940036,Receipt of 2 dos of Pfizer BioNTech vaccine be highly effective in prevent MIS C in person age 12 18 year ht,781503572995375104,2,Switzerland,Highly_Positive,
1262,2022-01-09 08:32:50,1480095206406070274,Look at the maker of these chemical This be from a web search use the phrase Pfizer criminal hist,25728193,0,Your nearest galaxy,Highly_Negative,
1263,2022-01-09 08:31:49,1480094951010672640,Also I can say that K Bus have demonstrate compassion empathy and care,551561890,0,,Neutral,
1264,2022-01-09 08:31:44,1480094928189464578,I have have Covid 19 and one dose of pfizer vaccination and I have an EU pas issue in Italy,37963496,0,,Neutral,
1265,2022-01-09 08:31:40,1480094910829277188,Dont worry theve get plenty line up for you Billy Gates and,157954831,0,"England, United Kingdom",Neutral,
1266,2022-01-09 08:31:31,1480094873458024454,Finally some good sense happen Pfizer vaccine VaccinesWork Not FauciLied BillGates VaccineMandate VaccinePasspor,1264275271,17,,Weakly_Positive,
1267,2022-01-09 08:31:24,1480094845955973121,I could show cold hard facts the point be you win t believe it I could show you the data from VARES CDC,1352374700840632320,0,"Delaware, USA",Highly_Negative,
1268,2022-01-09 08:31:18,1480094818965487616,a half dose of Moderna be still more than full dose Pfizer,3281095753,0,,Weakly_Positive,
1269,2022-01-09 08:31:17,1480094815652044801,Crikey why the Pfizer one too AZ amp Moderna arm hurt like hell but i e,711620076592615424,0,IN89rk,Neutral,
1270,2022-01-09 08:31:16,1480094810295865345,3 dos of Moderna report to be substantially more protective against omicron over time 70 than 3 dose,90561006,0,San Francisco,Highly_Positive,
1271,2022-01-09 08:31:12,1480094795213254662,you mean i can t rip a fat pfizer with the boy,109424761,0,,Highly_Negative,
1272,2022-01-09 08:31:11,1480094791224287233,Shouldn t the fact that The CDC want to withhold the information on the Pfizer trail for 75yrs make,1267555504324141057,0,,Neutral,
1273,2022-01-09 08:31:10,1480094787545939970,Howdy Liza I be very bless to my my 3rd shot on Nov24 21 all 3 shot be Pfizer I will take the 4th if I be told,309119004,0,,Weakly_Positive,
1274,2022-01-09 08:30:57,1480094730813902851,But you love Pfizer,275182995,0,Park Avenue,Highly_Positive,
1275,2022-01-09 08:30:38,1480094650123763714,It s Pfizer I think Republicans in Congress buy all their available stock between th,1254945257373876224,0,,Weakly_Positive,
1276,2022-01-09 08:30:24,1480094594159112195,Owned by Pfizer,1413988269461852160,0,The resistance - Earth world,Neutral,
1277,2022-01-09 08:30:15,1480094555638693888,New Zealand Prime Minister Jacinda Ardern do you really care about life of migrant How come you can manage everythin,1364641667282657281,17,,Weakly_Positive,
1278,2022-01-09 08:30:12,1480094542930096132,He have provide funding to get million of dos of the oral anti COVID drug make by Pfizer and Merck int,754183142873915392,0,Canada IJN,Neutral,
1279,2022-01-09 08:30:07,1480094521434296320,Those drug exist for a long time and have be test at least three year before s,365177563,0,Hrvatska,Highly_Negative,
