,DateTime,Tweet_Id,Tweet,User_Id,Retweet,Location,Label,Country
3309,2022-01-09 01:47:42,1479993252338089988,I think the Pfizer vaccine have be fully authorize since the summer If yo,486305407,0,,Neutral,
3310,2022-01-09 01:47:15,1479993136898211842,I AGREE ITS SCARY FDA WAS TOLD BY A JUDGE amp WAS JUST ANNOUNCED PFIZER HAS TO RELEASE THE VACCINE,1275820964681519109,0,UNDER THE OLIGARCHY OF AMERICA,Weakly_Negative,
3311,2022-01-09 01:47:11,1479993119156457476,My coworkers boyfriend go blind in his left eye due to a blood clot after the 2nd dose the Pfize,27915028,0,,Highly_Negative,
3312,2022-01-09 01:45:29,1479992692667035650,You seem very concerned about Pfizer vaccine what make you think I have a Pfizer vaccine,450339949,0,,Weakly_Positive,
3313,2022-01-09 01:45:10,1479992612597776387,A simple vaccine Have you ever work for big pharma I have pfizers lawsui,1182078493380825089,1,NYC/Philly,Neutral,
3314,2022-01-09 01:43:43,1479992249966632963,Every day there be more evidence against the vaccine efficacy amp every day Reuters try to combat e,1232003748886700032,0,Canada,Highly_Positive,
3315,2022-01-09 01:43:29,1479992188608077828,Savage jabit get school Brilliant 100 behind this doctor talk common sense Vaccine expert y,7587032,0,,Weakly_Positive,
3316,2022-01-09 01:43:28,1479992186649329667,The idiot refuse the Pfizer vaccine be rush to use the Pfizer blue pill to a a cure for covid,1424033022,0,,Highly_Negative,
3317,2022-01-09 01:41:24,1479991665695854595,The result show that vacci,138003961,0,"Nashville, TN",Neutral,
3318,2022-01-09 01:41:07,1479991592739950595,Apologies for the TMI academic follower on here but the vaccine delay my period by 14 day amp I m now in a LOT of pain wit,383311947,3,,Neutral,
3319,2022-01-09 01:38:47,1479991007479582723,What defection A link to the problem with the Pfizer va,797961378149650432,0,Wild Blue Yonder ,Neutral,
3320,2022-01-09 01:37:20,1479990641748811782,If Pfizer could slip the vaccine into a marinara or bolognaise we d be all set Nobody can resist Italian,18259219,0,,Neutral,
3321,2022-01-09 01:37:14,1479990614464897026,His plan be to put Fauci in charge and let him lie to Americans He also let Pfizer control the,92995558,0,"Lexington, KY",Neutral,
3322,2022-01-09 01:35:38,1479990213741101060,EXCLUSIVE Pfizer confirm to me that it be not ship it FDA approve vaccine call Comirnaty It be still ship,838457598303223808,892,Johannesburg,Neutral,
3323,2022-01-09 01:35:33,1479990191070879748,How about this after the general public and independent doctor scientist have fully review the,2791988124,0,,Weakly_Positive,
3324,2022-01-09 01:34:59,1479990050008014848,Vaccine profit to Pfizer BAD Viagra profit to Pfizer base on one sketchy anecdote GOOD,1216789842,0,"Ann Arbor, MI",Highly_Negative,
3325,2022-01-09 01:33:57,1479989790997204995,The way they market the pfizer vaccine in Sweden,827986550088667136,9,,Neutral,
3326,2022-01-09 01:33:46,1479989743500861442,I have zero respect for politician or so called journalist who support vax mandate amp,1234247369211961345,0,Planet Earth,Neutral,
3327,2022-01-09 01:33:06,1479989576815026177,No Moderna be even bad Pfizer be no 1 vaccine in the market,1391474708034379776,0,,Weakly_Negative,
3328,2022-01-09 01:32:40,1479989465397477376,The ignorance and selfishness of people who listen to the independent scientif,313882225,0,Let’s Go Brandon,Neutral,
3329,2022-01-09 01:31:04,1479989062685495296,Trials for Pfizer BioTech vaccine still don t end until mid 2023,1104448963887972353,0,Singapore,Neutral,
3330,2022-01-09 01:30:54,1479989024341254144,Would love to know where you re get your figure because Pfizer alone have 150 000 yellow,25708641,0,,Weakly_Positive,
3331,2022-01-09 01:30:22,1479988887573471232,I hear Pfizer use the same ingredient in both the vaccine and Viagra but change them into liquid form to use in a needle,981672200846675970,0,,Neutral,
3332,2022-01-09 01:30:09,1479988833672261632,The big winner of the pandemic Pfizer Vaccine oral medicine and Viagra,1362138406852190209,0,Beijing,Neutral,
3333,2022-01-09 01:29:49,1479988750432227331,CDC Advisers Endorse Pfizer Boosters for Kids 12 and Up COVID19 Covid 19,2869438390,1,"Johns Creek, GA",Neutral,
3334,2022-01-09 01:29:14,1479988603803602946,The Pfizer vaccine receive regulatory approval in the UK in December 2020 I m not in,2217981751,0,"Cornwall/Kernow, UK",Neutral,
3335,2022-01-09 01:27:40,1479988207043424263,I wonder if the irony of pfizer make a vaccine be totally lose on them,1216789842,0,,Neutral,
3336,2022-01-09 01:27:30,1479988167541415937,On Wednesday Pfizer submit data to the Food and Drug Admini,796092377131794432,0,,Neutral,
3337,2022-01-09 01:27:08,1479988075489021952,4 Two Doses of Pfizer Vaccine Has 22 5 Efficacy Against Omicron Symptomatic Infect,19115706,0,Georgia Coast,Neutral,
3338,2022-01-09 01:25:43,1479987717488676864,You know why they wan na mandate the vaccine for kid don t ya So big pharma like Pfizer be NO,948313838176362497,1,,Highly_Negative,
3339,2022-01-09 01:25:01,1479987542250475525,LOL meant to say Viagra and vaccine be make by Pfizer Nice pun,981672200846675970,0,Ohio,Highly_Positive,
3340,2022-01-09 01:24:05,1479987306274590720,Don t trust the vaccine from Pfizer but trust the boner pill from the same company okay,775953757511127040,0,"Peoria, Arizona",Weakly_Positive,
3341,2022-01-09 01:22:51,1479986996324020229,propaganda Pfizer make both the vaccine and Viagra What will you do now a hole,22703645,0,USA,Highly_Negative,
3342,2022-01-09 01:22:48,1479986984042962945,Official stats say with Pfizer the risk of myocarditis in your age group be 0,3176554771,0,"Sydney, Australia",Neutral,
3343,2022-01-09 01:22:00,1479986784012431364,Pfizer Wonder if the genius will realize same company a vaccine,301199565,0,,Neutral,
3344,2022-01-09 01:21:34,1479986673924870145,Yes I be very well and receive 2 dos of Pfizer Vaccine and booster shot with Pfizer Vaccine,1036959239728766977,0,,Weakly_Positive,
3345,2022-01-09 01:21:33,1479986668576948224,Just do an online check The Pfizer vaccine be available and in sto,4319716034,0,"Gainesville, Florida USA",Weakly_Positive,
3346,2022-01-09 01:21:31,1479986660188176385,I will As an American citizen I expect NOT to be force to take vaccine that,63925145,0,Washington State,Neutral,
3347,2022-01-09 01:21:22,1479986625472081921,Wtf Pfizer make the vaccine and the ED pill What fuck wire in their brain be they bear w,1268223690480615424,0,"Florida, USA",Highly_Negative,
3348,2022-01-09 01:20:48,1479986482723049473,You can t trust the vaccine bc it s make by Pfizer Which be why you should take Viagra instead,1298372735383605249,0,"Jackson, WY",Neutral,
3349,2022-01-09 01:18:56,1479986010373210114,Hopefully it stick Will be very interesting to see the corruption Pfizer want to hide from u for 75 year,759251,0,"Princeton, NJ",Highly_Positive,
3350,2022-01-09 01:18:50,1479985985479843843,The corrupt Pfizer contract Not only do your government sign up to a never test vaccine it have also promise Pfizer,87425704,261,,Highly_Negative,
3351,2022-01-09 01:18:43,1479985958229614594,I would be surprise if the Pfizer vaccine be out of stock,4319716034,0,"Gainesville, Florida USA",Neutral,
3352,2022-01-09 01:18:11,1479985820572520450,Viagra be also make by Pfizer So if Viagra s good enough for Tuck why isn t their vaccine,1216789842,0,,Weakly_Positive,
3353,2022-01-09 01:18:06,1479985801815420930,Vaccines and Related Biological Products Advisory Committee 9 17 2021 via Pfizer vaccine,1046763757,8,,Neutral,
3354,2022-01-09 01:17:54,1479985751685226499,LVCO Health Dept Vaccine Clinic January 13 2022 Walk in clinic No appoint necessary Offering Moderna Pfizer amp Johnso,2542072550,1,Kansas,Neutral,
3355,2022-01-09 01:17:18,1479985599884967936,They trust Viagra but not a vaccine that be both make by Pfizer,981672200846675970,14,"Columbus, OH",Neutral,
3356,2022-01-09 01:16:40,1479985438601658369,Hopefully it stick Will be very interesting to see the corruption Pfizer want to hide from u for 75 yea,2836421,0,"Princeton, NJ",Highly_Positive,
3357,2022-01-09 01:16:23,1479985370938888196,I m not give medical advice I m cite report fact and studi,1451395155731255299,0,,Neutral,
3358,2022-01-09 01:15:48,1479985224499228674,MAGAts trust Viagra but not the vaccine to cure covid not realize that both be make by Pfizer,707709149698588672,0,PinkoLiberalistan,Neutral,
3359,2022-01-09 01:15:13,1479985075437674497,Well now Looks like the REALLY BAD THINGS be actually more common after SARS CoV 2 infection than after the,473179284,636,,Highly_Negative,
3360,2022-01-09 01:15:07,1479985050884231171,,1349149096909668363,0,,Neutral,
3361,2022-01-09 01:14:08,1479984803378307074,A new study out of Israel find the natural immune protection develop after a COVID 19,1479227408058396677,0,,Weakly_Positive,
3362,2022-01-09 01:13:44,1479984702274609152,The vaccine be to boost profit for Pfizer amp Moderns They could give a fuck what it do,422715888,0,Lost in my thoughts,Highly_Negative,
3363,2022-01-09 01:13:38,1479984676882292739,What I mean be if the vaccine isn t effective do the vaccine death die for Pfizer and Moderna profit,1171170057549996032,0,The interwebs,Weakly_Positive,
3364,2022-01-09 01:12:34,1479984408656551943,Why can t they just take the vaccine It s also make by Pfizer What s wrong with these people Why,1262456293157003272,0,,Weakly_Negative,
3365,2022-01-09 01:12:33,1479984406018334723,Watch this Daz it will give you a comprehensive perspective on the Pfizer vaccine,128894104,0,"Bristol, England",Neutral,
3366,2022-01-09 01:11:40,1479984180947824641,Testimony of victim of side effect from the Corona vaccine They record their suffering after vaccination,1170668727337197568,9,,Highly_Negative,
3367,2022-01-09 01:11:37,1479984171313418248,Exactly right 99 of people have no idea about this Ask those vaccinate with,112520358,0,,Weakly_Positive,
3368,2022-01-09 01:09:54,1479983739774160902,Source 1 Among fully vaccinate,1176677534726885376,0,"New York, NY",Neutral,
3369,2022-01-09 01:09:47,1479983706798493700,Breaking Federal judge order FDA to quickly release all Pfizer vaccine via,10228272,1,30214,Weakly_Positive,
3370,2022-01-09 01:09:44,1479983697604407301,For some reason I think if you have get an mRNA vaccine you couldn t get a J amp J booster but cou,4617982346,0,United States,Neutral,
3371,2022-01-09 01:06:26,1479982863852486660,Taking a vaccine where we don t know the short term or long term effect be a gamble A Pfize,3367888154,0,Europe,Highly_Negative,
3372,2022-01-09 01:06:03,1479982768092188673,Free Vaccine Clinic Saturday January 8 from 9AM to 3PM at Rosemary School 401 Hamilton Ave in Campbell Provided b,768205011675324416,5,"San Jose, CA",Weakly_Positive,
3373,2022-01-09 01:05:57,1479982741785440257,We have be tell that omicron be less severe than alpha and delta so death rate and hospitalisation s,40778270,0,,Highly_Negative,
3374,2022-01-09 01:05:32,1479982640144998404,And because thus so called Vac be different Most folk be not anti Vac but wary,1372561271183134720,1,InYourHead,Neutral,
3375,2022-01-09 01:05:00,1479982506036375554,We have literally prove it The vaccine work Pfizer v Alpha variant be 95 effective bet,929571984689848320,0,Houston Texas,Highly_Positive,
3376,2022-01-09 01:04:51,1479982468258226178,Why would my doctor know whether the Pfizer vaccine be in stock And,4319716034,0,"Gainesville, Florida USA",Neutral,
3377,2022-01-09 01:03:34,1479982143380013057,You mean to say that the Pfizer Convax wasn t authorise for use on child on t,875672602131517443,0,"Bedford, England",Highly_Negative,
3378,2022-01-09 01:03:04,1479982020004560899,Many vaccinate people be get covid I say this a a vaccinated person The vaccine,2970645168,0,,Highly_Positive,
3379,2022-01-09 01:02:56,1479981985779142661,Same guy who will be 1st in line to get Pfizer s boner pill a a covid cure instead of trust,2493276151,0,,Neutral,
3380,2022-01-09 01:02:27,1479981864798633986,COVID 19 Hotez say that unlike the mRNA vaccine from Pfizer and Moderna and the viral vector vaccine from J amp J,1045124115965911040,2,,Neutral,
3381,2022-01-09 01:02:25,1479981853629042688,You should watch this it s an analysis of the Pfizer trial and data by independent Canadian doctor If y,128894104,0,"Bristol, England",Neutral,
3382,2022-01-09 01:00:06,1479981272105504768,Half the job at a god know the high cost An the 90 efficacy rate be on the basis that P,864738040782114816,0,Sydney,Highly_Negative,
3383,2022-01-09 01:00:05,1479981267433127936,He look like someone hold a turd under his nose Some people may also just have a weak immune sy,18948541,0,"Ravenwood Forest, Second Life",Highly_Negative,
3384,2022-01-09 00:59:02,1479981003330445312,Pfizer Makes a Rona Vaccine amp Viagra Won t trust one but trust the other,1251263076671709185,0,United States,Highly_Negative,
3385,2022-01-09 00:59:02,1479981003217281024,Where do you draw the line Sure encourage mandate vaccine Keep your eye on the Pfizer and Moderna p,312208310,0,"Ontario, Canada",Highly_Positive,
3386,2022-01-09 00:59:01,1479980996804034560,much good than,1474199074316296196,0,Decentralized,Highly_Positive,
3387,2022-01-09 00:58:47,1479980940906700800,Knowles My lung be full of blood clot and heart s under stress My new norm,825838620711989249,1,UK,Weakly_Positive,
3388,2022-01-09 00:57:54,1479980715924025344,The ATAGI recommendation take into consideration other factor include more real world data and pae,785224491496464384,0,Australia,Weakly_Positive,
3389,2022-01-09 00:56:58,1479980483974942723,My first two be Pfizer My third vaccine be Moderna,1280478731874848769,0,"the Late, Great USA",Weakly_Positive,
3390,2022-01-09 00:56:45,1479980429323091970,I be look for a booster EITHER Pfizer or Moderna Also the language select filter,8376792,0,,Neutral,
3391,2022-01-09 00:55:27,1479980102335172608,I win t take the Pfizer vaccine because I don t know what s in it I ll take this Pfizer boner pill instead,1268223690480615424,0,"Los Angeles, CA",Highly_Positive,
3392,2022-01-09 00:55:26,1479980095615942656,So people win t take the Pfizer vaccine but will willingly take the Pfizer therapeutic Someone,48159456,1,,Highly_Positive,
3393,2022-01-09 00:55:22,1479980079987970049,What d I do In some lot it s easy to get out Besides who need viagra You get 2 for one boo,1413628042698797059,0,"Frisco, TX",Weakly_Positive,
3394,2022-01-09 00:55:08,1479980023369064448,They have a preference for Sputnik vaccine be you specifically o,1183772224181940224,0,,Neutral,
3395,2022-01-09 00:54:07,1479979764748222464,It be what make Nats so totally reprehensible Pfizer try to develop a vaccine for un,393031708,0,Aotearoa,Neutral,
3396,2022-01-09 00:52:36,1479979382940782595,The video Twit Banned show Pfizer s own vaccine trial data conclusively confirm an INCREASED risk of Illness amp Death for,1416206705923268609,3,,Highly_Positive,
3397,2022-01-09 00:52:17,1479979305744666633,Hopefully his family sue or whichever vaccine he take,15392486,0,USA,Neutral,
3398,2022-01-09 00:52:05,1479979255463243779,Vaccine induce myocarditis Its on the Pfizer label Its on the TGA a a side effect And the govt want to,1275283569758269440,2,Brisbane,Neutral,
3399,2022-01-09 00:52:04,1479979251742883840,Yep Also case do NOT equal infection Wake up please Now flurona R,1451808559797182465,0,"🏄🌴🐬San Diego, CA  USA",Neutral,
3400,2022-01-09 00:51:47,1479979177004736512,Court REJECTS FDA Request to Release Vaccine FOIA Documents Over the Next 55 Years Orders Agency to Turn Over Tens of,594237214,3,Central Minnesota,Neutral,
3401,2022-01-09 00:51:02,1479978987900309510,in March 2021 my cousin accidentally receive a whole vial 6 dos of the vaccine when g,146569971,0,,Weakly_Positive,
3402,2022-01-09 00:50:08,1479978762989195265,Quite the contrary The judge order 50 000 page per month to be release The Pfizer shit will,1386118909934280708,0,"Ontario, Canada",Highly_Negative,
3403,2022-01-09 00:48:06,1479978251371958273,Former Pfizer Employee Karen Kingston on Covid mRNA Vaccine Patent Ingredients That Will Bring Spike of Deadly Cancer,1046763757,12,,Highly_Negative,
3404,2022-01-09 00:46:54,1479977951001255941,DR Mike Yeadon former chief scientist for Pfizer say child,1068311813425688578,0,"Wales, United Kingdom",Neutral,
3405,2022-01-09 00:44:55,1479977450310299649,Covaxin be literally willing to pay you if you have side effect from their vaccine it just show you how confident,1443297529664258052,62,Gold Coast,Weakly_Positive,
3406,2022-01-09 00:44:29,1479977339815485443,It will only be a life sentence if you don t receive 2 dos of the P,858638319982227456,0,,Neutral,
3407,2022-01-09 00:43:47,1479977163520573440,Yeah load up on 500 Vaccine shot they really help Pfizer and Moderna s profit,820452522494226433,0,,Weakly_Positive,
3408,2022-01-09 00:42:44,1479976899820535814,For her the benefit do not outweigh the risk However,1240329439705268224,0,,Neutral,
3409,2022-01-09 00:42:24,1479976817805213701,Lots of vaccine appointment at the village mall where 18 29 can get Pfizer booster,113363456,3,"Mount Pearl, Newfoundland and ",Neutral,
3410,2022-01-09 00:40:11,1479976257622142977,That s why case be high they be cover up the vaccine injuries say it s covid Been do it since the,1419111323707711489,2,Brisbane,Weakly_Positive,
3411,2022-01-09 00:39:33,1479976100671414272,Ask yourself why Pfizer have hide their data for generation I think their data will,811704294743359493,0,,Neutral,
3412,2022-01-09 00:39:05,1479975982597652480,Most big pharma company have do bad stuff But they ve also produce many of the vaccine,2846809907,1,,Weakly_Positive,
3413,2022-01-09 00:38:13,1479975764741308417,Transparency be a good one A judge just overrule the FDA request to relea,780974828559867904,0,,Highly_Positive,
3414,2022-01-09 00:37:39,1479975619790139392,I speak for all of America when I say we should not let anyone outside their house until they have receive,1349149096909668363,0,,Neutral,
3415,2022-01-09 00:37:22,1479975548663255041,Aaron Siri Tweeted I be pleased to report a federal judge reject the FDA s request to produce the,1446256675808186384,0, Ontario canada,Highly_Positive,
3416,2022-01-09 00:37:15,1479975522956414978,You know why they wan na mandate the vaccine for kid don t ya So big pharma like Pfizer,811704294743359493,1,,Highly_Negative,
3417,2022-01-09 00:36:47,1479975403963957249,Most big pharma company have do bad stuff But they ve also produce many of the v,2217981751,1,"Cornwall/Kernow, UK",Weakly_Positive,
3418,2022-01-09 00:36:34,1479975349412941829,It s a Pfizer drug They also make a vaccine,703261118815457280,1,,Neutral,
3419,2022-01-09 00:36:26,1479975313694150657,Pfizer Since I get my vaccine between the Olympics and the US Open I have a pro,99206658,0,,Neutral,
3420,2022-01-09 00:36:18,1479975282798960640,Pfizer make Viagra so I guess if they don t get the vaccine money then,1167440213213425664,0,"Ybor City, Tampa, FL",Neutral,
3421,2022-01-09 00:35:47,1479975152532209664,Me currently diagnose yesterday Fully vaccinate with Pfizer force to get it to keep my jo,1177326047223676929,50,East Coast ,Neutral,
3422,2022-01-09 00:34:29,1479974824206389248,My grandfather be Muslim I be there when he die hold my hand Im get recurrant dream,1457888453937483776,0,,Neutral,
3423,2022-01-09 00:34:21,1479974793294139392,Judge Orders Biden Admin To Release Info On Pfizer COVID Vaccine Within Months Not 75 Years via,312149882,18,"ÜT: 38.734864,-121.235049",Neutral,
3424,2022-01-09 00:32:29,1479974323029004289,I ll send you a second link The Pfizer vaccine have full approv,1337772494,0,"Michigan, USA",Weakly_Positive,
3425,2022-01-09 00:32:20,1479974283032027140,But you can t get the vaccine it s just give money to drug company like Pfizer who also create,818893114979061761,0,Everywhere,Neutral,
3426,2022-01-09 00:32:18,1479974276665073664,Is this just with the Pfizer vaccine,95092020,0,United Kingdom,Neutral,
3427,2022-01-09 00:32:08,1479974233765822465,Is this because they don t trust Pfizer who make a vaccine so they use a drug make by check note Pfizer,372563164,0,,Neutral,
3428,2022-01-09 00:28:25,1479973296540114946,Yes that be part of the agenda Canada finally start add the little one,253353616,1,,Highly_Negative,
3429,2022-01-09 00:25:58,1479972682728837120,So they believe in viagra Pfizer to fight Covid but not the vaccine Pfizer to fight Covid,1316308548,0,"New Mexico, USA",Neutral,
3430,2022-01-09 00:25:36,1479972590663790593,Pfizer BioNTech s COVID 19 vaccine win t be available anytime soon for kid young than 5 year old,15754281,24,,Weakly_Positive,
3431,2022-01-09 00:25:32,1479972570539638784,Also the fact that Pfizer will not release the,1407362229234765830,0,,Neutral,
3432,2022-01-09 00:25:29,1479972557839237121,,1246805790775816194,1,United States of America,Neutral,
3433,2022-01-09 00:25:10,1479972481838432256,1 People who get either the Pfizer BioNTec,64660318,0,"3rd rock from sun, in So CA",Neutral,
3434,2022-01-09 00:25:10,1479972479837769728,People call for a delay to school until child be vaccinate but in Australia the 5 11 year old vaccine be Pfiz,1727466480,1,Melbourn Boonwurrung country,Weakly_Positive,
3435,2022-01-09 00:25:06,1479972465535164419,Before we give up maybe we should wait until 1 Pfizer s upgrade vaccine for omicron be in distrib,87818409,0,,Neutral,
3436,2022-01-09 00:24:39,1479972350510645251,and the OmicronVariant have be terrible Please share your tax payer fund CovidVaccine w,120730781,0,,Weakly_Negative,
3437,2022-01-09 00:24:25,1479972292167884802,Who be they Preliminary laboratory study demonstrate that three dos,1455158253067902980,0,,Neutral,
3438,2022-01-09 00:23:21,1479972024915091458,So Pfizer vaccine bad but Pfizer dick pill good,76215355,1,"Victoria, Australia",Weakly_Positive,
3439,2022-01-09 00:23:13,1479971989460865031,Saying Pfizer Vax be A and Cominarty be B doesn t make a difference,2415126655,0,"Gainesville, Florida USA",Neutral,
3440,2022-01-09 00:22:23,1479971781154947072,BioNTech develop the mRNA vaccine not Pfizer,2217981751,0,,Neutral,
3441,2022-01-09 00:21:45,1479971621016199168,This be the guy who delay FDA approval of the Pfizer COVID vaccine for political reason to penalise Trump be it not,793964025490984961,0,"Sydney, New South Wales",Neutral,
3442,2022-01-09 00:21:06,1479971457534935040,Sara Jessica Blattner 14 Years old USA Vaccine Pfizer Dose 1 June 2021 Dose 2 None Died October 12 2021 Sara,226109322,3,,Weakly_Positive,
3443,2022-01-09 00:19:43,1479971106647953409,Youre free to sign up for quarterly injection of this vaccine which wan in effica,4509559821,0,,Weakly_Positive,
3444,2022-01-09 00:19:26,1479971038129577985,I take immunosuppressant medicine for Crohn s I know my health and I know what s best for me I simply su,1431481530594041857,0,"Texas, USA",Highly_Positive,
3445,2022-01-09 00:19:21,1479971018487877638,that s not very nice Sue Boris be a top man and I be sure that neither,952481101,0,,Weakly_Positive,
3446,2022-01-09 00:19:09,1479970968051224576,This study might shed some light on your understanding,2340956972,0,USA,Weakly_Positive,
3447,2022-01-09 00:17:42,1479970602563768320,The we don t need to prove anything just trust u thing be so weird Thankfully it look like we,328801479,0,"Dallas, TX",Weakly_Negative,
3448,2022-01-09 00:17:17,1479970494707159042,Federal judge order the FDA to release Pfizer s COVID vaccine data at a rate of 55 000 page per month instead of 500 p,1445243235186532354,7,New Zealand,Neutral,
3449,2022-01-09 00:16:55,1479970405720879105,I have 3 shot of Pfizer I think it s the smart thing to do But I also respect the individual freedo,1355714624105005056,0,Not USA,Weakly_Positive,
3450,2022-01-09 00:16:07,1479970202385207301,How about treat the virus What a fackin concept Monoclonal antibody Working in Florid,2596842990,0,,Neutral,
3451,2022-01-09 00:15:52,1479970138115948549,Federal Judge Gives FDA 8 Months to Release Pfizer Vaccine Safety Data via,457984599,0,,Neutral,
3452,2022-01-09 00:15:10,1479969963897196544,Every time you see these headline remember that over a month ago Pfizer report the vaccine for kid,151257881,0,"Seattle, WA",Neutral,
3453,2022-01-09 00:15:09,1479969959769956356,Couldn t agree more P zer be the mafia of big pharma The Gov have give license to print money with no l,41702018,1,,Weakly_Positive,
3454,2022-01-09 00:14:53,1479969892359184384,So the guy who once claim Pfizer s vaccine didn t work be now promote a Pfizer product The hell be we even do,1268223690480615424,0,Canada,Neutral,
3455,2022-01-09 00:14:34,1479969812927467524,The group with breakthrough infection case 47 be more frequently vaccinate with Pfizer BioNTech vaccine,2806451980,1,,Weakly_Positive,
3456,2022-01-09 00:13:17,1479969490792239110,destroys covid to the point where you basically can t get infect i don t trust pfizer to make,1202116151108685824,0,,Neutral,
3457,2022-01-09 00:12:27,1479969281932726273,They may not have get the memo that Pfizer make Viagra They swallow unprescribed med but fear,1298372735383605249,0,,Neutral,
3458,2022-01-09 00:12:23,1479969263804891143,Best part be the close up to their face when they realize that Pfizer be the same vaccine manufacturer,981672200846675970,0,"Pre: 34.665958,-104.058309",Highly_Positive,
3459,2022-01-09 00:11:28,1479969033160118274,The vaccine Pfizer Moderna J amp J be never a sterilize vaccine simply due to the fact that they ta,1448079196325130241,1,"Rochester, MN",Highly_Negative,
3460,2022-01-09 00:11:04,1479968929925799942,true idc abou the vaccine themselves i be somewhat pressed about let big pharma have an inf,1202116151108685824,0,,Weakly_Positive,
3461,2022-01-09 00:10:51,1479968879334117377,Im curious those of you who suffer side effect of your 2nd or 3rd COVID jab what vaccine do you get All 3 of mine,116261712,1,🏴󠁧󠁢󠁳󠁣󠁴󠁿,Highly_Negative,
