,DateTime,Tweet_Id,Tweet,User_Id,Retweet,Location,Label
641,2021-12-30 14:09:38,1476556086643671040,Why is no one pressuring our Government for more vaccine options Plenty of traditional vaccines that people wou,1448614625935769604,1,America,Weakly_Positive
642,2021-12-30 14:08:26,1476555784582483968,The interview with Dr Fauci maybe he misspoke about #Covaxin Clearly they don t care about the we,1217198127591186437,0,,Weakly_Positive
643,2021-12-30 14:07:36,1476555574162636804,Keep pressuring and We let it slide when Canada s regulatory authority came out and said W,876589381791997952,22,,Neutral
644,2021-12-30 14:05:38,1476555078639177733,What s the situation with #ocugen application for #covaxin,208120290,0,,Neutral
645,2021-12-30 14:03:18,1476554491919048706,Around minute 16 Director Dr Fauci states on record that ha,1354279893232545793,1,,Neutral
646,2021-12-30 14:02:28,1476554280018587648,You should have done some research before talking to Dr Fauci to inform him an EUA was ind,1217198127591186437,0,,Neutral
647,2021-12-30 14:02:11,1476554209394937872,Why is no one pressuring our Government for more vaccine options Plenty of traditional vaccines that pe,86970530,1,,Weakly_Positive
648,2021-12-30 14:01:48,1476554113617903619,We need #COVAXIN now #OCUGEN Approve,1301206340069715970,25,,Neutral
649,2021-12-30 14:01:06,1476553938480553986,#COVAXIN why is it so hard to share SOMETHING with us about what is going on,876589381791997952,0,,Highly_Negative
650,2021-12-30 13:59:04,1476553425731010562,#COVID19 has announced that BBV152 #Covaxin has proven to be safe well tolerated and immunogen,2590932906,4,India,Highly_Positive
651,2021-12-30 13:57:45,1476553095110967300,WTF #OCUGEN #COVAXIN EUA FOR ADULTS WAS FILED IN MAY ACCORDING TO YOU GUYS AND B,1456357158803709958,1,,Weakly_Negative
652,2021-12-30 13:57:03,1476552920472887299,we need Dr Malone to talk with about #COVAXIN especially now as Dr FAUCI lied on the news,1237612672373248000,0,,Neutral
653,2021-12-30 13:56:37,1476552810762313743,Absolutely absurd can you fact check this Fauci s claim that #COVAXIN is not submitted for FDA approval,225265639,0,"Toronto, Ontario",Weakly_Negative
654,2021-12-30 13:56:00,1476552653131988992,Fauci just lied on National TV this morning claiming #COVAXIN was not submitted for FDA approval and,1433560725562159110,0,Global Citizen,Neutral
655,2021-12-30 13:54:00,1476552150306091012,To fir AIIMs k Doctor jhut bol rehe the kiya Jo khud vaccine trial k group me tha C,240649814,0,,Neutral
656,2021-12-30 13:53:05,1476551922412834816,#COVAXIN as if not more effective in kids than adults It s the BEST We n,208120290,0,,Weakly_Positive
657,2021-12-30 13:53:02,1476551908093399042,#BharatBiotech says #Covaxin is safe for children between 2 18 years,3106565906,0,"Hyderabad, Telangana, India",Highly_Positive
658,2021-12-30 13:52:09,1476551684222590985,Can you say this pose who pretend to be a doctor Fauci lies about application in the US that Ocugen di,1354279893232545793,3,London,Neutral
659,2021-12-30 13:51:01,1476551400746278912,1 2 he flat out LIED and people wonder why there is no trust in his science He said,1217198127591186437,0,,Highly_Negative
660,2021-12-30 13:49:03,1476550906762174471,Please be the first politician to mention #COVAXIN the only traditional vaccine which has applied for EUA I bel,296320706,1,"Warren, OH",Weakly_Positive
661,2021-12-30 13:47:42,1476550566767702018,We have #COVAXIN waiting for approval Why don t we use all the tools we have to save these kids,785323158962221056,1,,Neutral
662,2021-12-30 13:47:35,1476550535461355522,You better come out and clear this fu king mess up for the investors who is lying You or fauci #covaxin #Fauci #ocugen,876589381791997952,0,"Leeds, England",Weakly_Positive
663,2021-12-30 13:47:27,1476550504377421827,Fauci just claimed the US has the cream of the crop vaccines and then lied on TV saying Covaxin ha,975200486,0,Global Citizen,Neutral
664,2021-12-30 13:45:27,1476549998305292291,Fauci is intentionally spreading lies about #covaxin to promote less effective more dangerous mRNA vaccines At the very,1217482696126894080,2,"Uusimaa, Suomi",Weakly_Positive
665,2021-12-30 13:44:54,1476549859373162501,I am fully vaccinated with mRNA and this was BEFORE I did my research It s been a year since I came upon #COVAXIN and,1395910534877257731,1,"Uusimaa, Suomi",Neutral
666,2021-12-30 13:41:59,1476549127106445314,I don t think he s allowed to say any positive thing about #covaxin He is another puppet just like th,1456357158803709958,0,,Weakly_Positive
667,2021-12-30 13:40:11,1476548673588899840,said that #COVAXIN is safe for children With the grace of Lord Ram we will overcome this pandemic #Covaxin4Kids,2590932906,0,India,Highly_Positive
668,2021-12-30 13:39:25,1476548479673532416,#Covaxin has proven to be safe well tolerated and immunogenic in 2 18 years of age volunteers who participated in Pha,161318053,1,,Highly_Positive
669,2021-12-30 13:39:03,1476548388720201729,Please respond to Fauci s statement #COVAXIN #Ocugen,2590932906,0,,Neutral
670,2021-12-30 13:38:28,1476548243366547458,Please respond to Fauci s statement #COVAXIN #Ocugen,2590932906,1,,Neutral
671,2021-12-30 13:37:50,1476548080870768640,bring on the #COVAXIN #covaxinapproval #covaxin4children #covaxin4kids,208120290,0,,Neutral
672,2021-12-30 13:37:37,1476548027179491338,We should look Traditionally made Vs mRNA but MEDIA is twisting their narrative to VACCINATED Vs unvaccinated India i,1395910534877257731,2,"Uusimaa, Suomi",Neutral
673,2021-12-30 13:37:20,1476547958678114312,No otherwise Twitter account will be suspended if doctors or journalists talk about #covaxin,133027585,1,"Uusimaa, Suomi",Neutral
674,2021-12-30 13:37:01,1476547877614886917,Please respond to Fauci s statement #COVAXIN #Ocugen,2590932906,5,,Neutral
675,2021-12-30 13:35:17,1476547440778125312,Enough of the silence Fauci claims no applications submi,1456357158803709958,3,Global Citizen,Neutral
676,2021-12-30 13:32:51,1476546828212473856,Bharat Biotech says its vaccine #Covaxin is found to be safe and immunogenic in 2 18 age group,738115375477362688,3,"Jaipur, India",Highly_Positive
677,2021-12-30 13:29:47,1476546056275968002,No otherwise Twitter account will be suspended if doctors or journalists talk ab,1456357158803709958,1,,Neutral
678,2021-12-30 13:24:56,1476544835129589766,Just watched you respond to a question about vaccines for children under the age of 5 on where y,15012486,13,,Neutral
679,2021-12-30 13:23:36,1476544499660861442,There we go #covaxin,1456357158803709958,0,Nederland,Neutral
680,2021-12-30 13:22:22,1476544191626842112,Tick tock if there are options and it s trial are effective with NO major side effects of concern than we t,208120290,2,,Weakly_Positive
681,2021-12-30 13:20:48,1476543795734929413,sounds confident of bringing #COVAXIN to the West When politics are finally put to the si,1346959294625812481,1,"Florida, USA",Weakly_Positive
682,2021-12-30 13:20:39,1476543758493700100,A oldie but goodie Let s not forget it s a matter of if not when #covaxin OCGN my favorite part NO SAFTEY CONCERNS Aka,1302240056871194625,8,"Florida, USA",Highly_Positive
683,2021-12-30 13:18:19,1476543169273737220,#Covaxin #Vaccigen #HealthCanada #Covid19 #Delta #Omicron #Covid #Pediatrics,14499829,0,,Neutral
684,2021-12-30 13:15:05,1476542357721935874,Vaccine manufacturer on Thursday said #Covaxin has proven to be safe well tolerated and immunogeni,2590932906,0,India,Highly_Positive
685,2021-12-30 13:10:33,1476541216279785473,As predicted by Great Visionary Dr jee #Breaking Covaxin has proven to be safe well t,60937837,3,,Highly_Positive
686,2021-12-30 13:06:28,1476540187882627072,#Covaxin successfull for children as well without side eff,1100927498,0,Bharat,Neutral
687,2021-12-30 13:05:08,1476539855123406848,YOU have the answer through in care of their USA Partner,1187835922118787073,0,,Neutral
688,2021-12-30 13:00:37,1476538718563586048,YOU HAVE SOME SERIOUS EXPLAINING TO DO through in care of their USA Partner,208120290,2,,Highly_Negative
689,2021-12-30 12:59:28,1476538426023243777,Stop blaming the unvaccinated that s the media narrative to divide us #COVAXIN is on desk si,407464670,0,,Neutral
690,2021-12-30 12:51:37,1476536449772175364,Stop blaming the unvaccinated that s the media narrative to divide us #covaxin is on des,1006474869570093056,0,,Neutral
691,2021-12-30 12:50:44,1476536230292697088,Please be the first politician to mention #COVAXIN the only traditional vaccine which has applied for E,37190669,1,"Los Angeles, CA",Weakly_Positive
692,2021-12-30 12:49:01,1476535798128205826,Stop blaming the unvaccinated that s the media narrative to divide us #covaxin is on desk since May 2021,208120290,6,,Neutral
693,2021-12-30 12:47:49,1476535495567962116,Welcome development as we encounter another variant of virus Let us secure safety of our children,2590932906,0,"Bengaluru South, India",Highly_Positive
694,2021-12-30 12:47:05,1476535310800408580,Bharat Biotech says its #Covaxin has prov,53097729,0,universe,Neutral
695,2021-12-30 12:46:42,1476535214167916545,No shit they be flying mentally at a stand still traffic light but oh wait the light is,36375825,0,,Weakly_Positive
696,2021-12-30 12:43:41,1476534455179354115,Got some other locations we re gonna hear about soon OCGN #COVAXIN I admire that Ocu,1456357158803709958,12,"Uusimaa, Suomi",Highly_Negative
697,2021-12-30 12:42:50,1476534241760587783,Why the didnt approve yet #Covaxin #Covaxin4Kids,1652541,0,,Neutral
698,2021-12-30 12:42:48,1476534233204019201,#Imp in a statement #Covaxin has proven to be safe well tolerated immunogenic in 2 18 year olds,2590932906,3,"New Delhi, India",Highly_Positive
699,2021-12-30 12:39:15,1476533338307452929,#COVAXIN IS THE ONLY VACCINE THAT WORKS AND SAFE FOR EVERYBODY,25589776,0,"Boca Raton, FL",Weakly_Positive
700,2021-12-30 12:32:19,1476531593342853121,Someone tell Dr Fauci #COVAXIN has applied for FDA approval HELLO,124237063,0,"Oklahoma City, OK",Neutral
701,2021-12-30 12:31:09,1476531299842154500,YOU have the answer through in care of their USA Partner,1461377821725581316,1,,Neutral
702,2021-12-30 12:28:02,1476530517373767686,of out there raiding vaccination centres #COVID19 #vaxchristmas #COVAXIN,19458172,0,Republic of wales,Neutral
703,2021-12-30 12:27:00,1476530257800970246,Flood them with OCGN #Covaxin questions,1001175056322629632,0,"Oklahoma City, OK",Neutral
704,2021-12-30 12:24:50,1476529710486151176,YOU have the answer through in care of their USA Pa,1217198127591186437,1,,Neutral
705,2021-12-30 12:23:43,1476529431078445056,The and held up a traditional inactivated virus vaccine that is approved with proven results News out,1458477298844409861,2,"Uusimaa, Suomi",Neutral
706,2021-12-30 12:20:46,1476528688565006336,YOU have the answer through in care of their USA Partner #COVAXIN has b,208120290,0,,Neutral
707,2021-12-30 12:20:22,1476528588920926217,Let s Together Stop the Spread With the presence of the latest COVID variant of concern Omicron It s the right,1271747682,1,,Weakly_Positive
708,2021-12-30 12:19:36,1476528395374714882,YOU have the answer through in care of their USA Partner #COVAXIN has b,208120290,1,,Neutral
709,2021-12-30 12:17:16,1476527807887028230,YOU have the answer through in care of their USA Partner #COVAXIN has b,208120290,0,,Neutral
710,2021-12-30 12:00:40,1476523630599286786,45 #URBAN #Bengaluru #CovidVaccine Availability for 30 12 at 05 30PM FREE Slots 0 PAID Slots #COVISHIELD Dose1 119 Dose2 1,1406895607680102404,1,,Weakly_Positive
711,2021-12-30 11:58:26,1476523066918244353,Ma am I have just got tested and I am negative So far I can say that my #Covaxin vaccination is ke,41094453,8,Mumbai,Highly_Negative
712,2021-12-30 11:51:33,1476521335715250178,I DON T WANT TO HEAR SHIT FROM FAUCI IF IT S NOT ABOUT APPROVING #COVAXIN NEXT,1209495528,1,,Highly_Negative
713,2021-12-30 11:08:15,1476510439005507594,who to believe and who not #COVID19 #Omicron #LargestVaccineDrive #VaccineSideEffects,1293113010941296640,0,,Neutral
714,2021-12-30 11:08:04,1476510390645309440,I guess nearly 500k of new #covid cases yesterday is the Biden plan working I mean since he said he had a plan to wipe i,1293697365556301837,1,,Highly_Negative
715,2021-12-30 11:05:58,1476509862079176704,45 #URBAN #Bengaluru #CovidVaccine Availability for 30 12 at 04 30PM FREE Slots 0 PAID Slots #COVISHIELD Dose1 119 Dose2 1,1406895607680102404,1,,Weakly_Positive
716,2021-12-30 11:05:28,1476509739764830209,Straight up #Pfizer is basically the Ivan Milat in the pharmaceutical world Your government is willing to RUIN your LIFE,929783724664688640,1,,Weakly_Positive
717,2021-12-30 10:43:03,1476504098367225862,There is one #COVAXIN a traditional whole virion vax that is being snubbed and delayed by the FDA It als,1440099899345825793,0,Global Citizen,Weakly_Positive
718,2021-12-30 10:33:19,1476501646683213825,The #COVAXIN vaccine has been approved by WHO for emergency use on Wednesday 3rd November 2021 The approval came after,3358476335,1458,"Bihar, India",Neutral
719,2021-12-30 10:13:39,1476496697475964928,What about the old fashioned vaccine that is out that s been proven for years #Covaxin,3109914687,0,United Kingdom,Weakly_Positive
720,2021-12-30 10:11:05,1476496054358970369,Wednesday 29 12 21 #CoWIN Dashboard amp figures #COVID19 cases 13 154 No vaccinated 6 391 282 1st do,2596143056,0,Deccans of India ,Neutral
721,2021-12-30 10:02:34,1476493907194269698,Vaccines aren t their only plan to depopulate the world homosexuality is some form of depopulation but very few will g,1292939014434172934,1,"Braamfontein, Johannesburg",Highly_Negative
722,2021-12-30 10:01:47,1476493709860556805,45 #URBAN #Bengaluru #CovidVaccine Availability for 30 12 at 03 30PM FREE Slots 0 PAID Slots #COVISHIELD Dose1 119 Dose2 1,1406895607680102404,1,,Weakly_Positive
723,2021-12-30 09:51:50,1476491206901178372,Ministry of Health issues guidelines for COVID vaccination of children aged between 15 to 18 Reported by,165365383,2,"From Lucknow, now in Mohali",Highly_Negative
724,2021-12-30 09:49:53,1476490716297588736,Just in #Covaxin arrives in city for 15 18 yr children 93k doses have been received #Chandigarh,75009882,4,India,Neutral
725,2021-12-30 09:47:29,1476490113714507779,Yes We are going to take #covaxin as our last two shots were #COVISHIELD,108252113,0,,Neutral
726,2021-12-30 09:35:58,1476487216994000898,Unf,20624950,0,,Neutral
727,2021-12-30 09:26:54,1476484934554382340,#BREAKING DCGI approves Bharat Biotech s #Covaxin vaccine for children Vaccine approved for children aged 12 to 18,49275747,7,,Highly_Negative
728,2021-12-30 09:26:37,1476484862165012487,Ji Please send #COVAXIN or #COVISHIELD to US on an emergency and humanitarian basis Their #Pfizer se,815716863183351809,1,Hell,Neutral
729,2021-12-30 09:12:52,1476481401604042753,Well it seems they have solved those issues as the EU has recommended their approva,249846653,0,,Neutral
730,2021-12-30 09:09:48,1476480631559364613,This would not happen if had the approval for #covaxin,44196397,0,"Madrid, España",Neutral
731,2021-12-30 09:03:25,1476479022926372867,What are the side effects of this vaccine every medication has some side effects,911182427782909952,0,"Bengaluru, India",Neutral
732,2021-12-30 09:00:16,1476478232534962182,45 #URBAN #Bengaluru #CovidVaccine Availability for 30 12 at 02 30PM FREE Slots 0 PAID Slots #COVISHIELD Dose1 120 Dose2 1,1406895607680102404,1,,Weakly_Positive
733,2021-12-30 08:58:25,1476477763376668675,Ummm no Can t blame republicans for this I m a democrat These mRNA vaccines do not cut it,2968626209,0,,Neutral
734,2021-12-30 08:49:24,1476475496342851586,If we were to approve #COVAXIN it would be a different story Don t come complaining to us when you shoul,631221668,0,,Neutral
735,2021-12-30 08:32:21,1476471203732889602,,6942422,7,,Neutral
736,2021-12-30 08:31:53,1476471086821044224,WE NEED APPROVAL #Covaxin #Ocugen #BharatBiotech #Covid19 #Vaccine,1209495528,6,,Neutral
737,2021-12-30 08:26:22,1476469701500760065,We need these proclaimed Twitter News Analysts amp Anchors w 50k followers pushing #C,1425860048539037697,3,,Neutral
738,2021-12-30 08:23:51,1476469065350746115,For the 1 000 000th time you corrupt scoundrels people want an inactivated traditional vaccine like #,1352762523540455424,3,,Highly_Negative
739,2021-12-30 08:00:23,1476463159712137216,45 #URBAN #Bengaluru #CovidVaccine Availability for 30 12 at 01 30PM FREE Slots 0 PAID Slots #COVISHIELD Dose1 120 Dose2 1,1406895607680102404,1,,Weakly_Positive
740,2021-12-30 07:46:34,1476459683233734660,Pfizer agents are understandably restless #Covaxin ki jai,3097503906,0,,Neutral
741,2021-12-30 07:24:24,1476454105556082689,Ji Please send #COVAXIN or #COVISHIELD to US on an emergency and humanitarian basis Their,18839785,1,Hell,Neutral
742,2021-12-30 07:17:26,1476452353062498308,I will be getting my booster of mRNA because has recommended us in healthcare to do so plu,1351236267707654145,0,"Marina, CA",Neutral
743,2021-12-30 07:00:57,1476448203167911939,45 #URBAN #Bengaluru #CovidVaccine Availability for 30 12 at 12 30PM FREE Slots 0 PAID Slots #COVISHIELD Dose1 120 Dose2 1,1406895607680102404,1,,Weakly_Positive
744,2021-12-30 06:58:33,1476447597783134213,I couldn t agree more We need more options than what Canada is offering at th,1244651172,1,Canada,Highly_Positive
745,2021-12-30 06:52:42,1476446127604092932,The and held up a traditional inactivated virus vaccine that is approved with proven results,208120290,2,Texas,Neutral
746,2021-12-30 06:25:49,1476439363546497024,Hey mr Elon have you heard of #COVAXIN,44196397,0,"Philadelphia, PA",Neutral
747,2021-12-30 06:09:42,1476435307381723137,,1473547173694423046,0,United States,Neutral
748,2021-12-30 06:03:39,1476433783419129857,When is #covaxin going to approved when does the catering to big pharmacy stop the people deserve more options,36375825,0,United States,Weakly_Positive
749,2021-12-30 06:02:58,1476433610429374466,45 #URBAN #Bengaluru #CovidVaccine Availability for 30 12 at 11 30AM FREE Slots 0 PAID Slots #COVISHIELD Dose1 120 Dose2 1,1406895607680102404,1,,Weakly_Positive
750,2021-12-30 05:59:54,1476432840036343813,And why won t anyone mention #covaxin Is big pharma really powerful enough to control EVERYONE and what they say,321954654,0,Texas,Weakly_Positive
751,2021-12-30 05:55:53,1476431827464519680,Request lowering age of beneficiaries in India for #vaccination of #COVAXIN to Childrens aged 12 15y,2590932906,3,"Ahmedabad, Gujarat. INDIA",Highly_Negative
752,2021-12-30 05:39:56,1476427814920503301,Want to get the word out about #COVAXIN #Covaxin4Kids and Then click the link below and submit a question Enoug,1458477298844409861,1,,Neutral
753,2021-12-30 05:38:13,1476427385184473090,#Covaxin drug substance by April 2022 #PVR increases movie ticket prices by 50 in #Telangana #Paytm Payments Bank appoints,895941182290665472,1,"Mumbai, India",Neutral
754,2021-12-30 05:34:43,1476426504271716353,Yay Now lets approve #COVAXIN since the US was only able to create a useless vaccine that will never get us out this plandemic,2985479932,0,,Neutral
755,2021-12-30 05:29:19,1476425142528094209,Likewise #COVAXIN vaccinated Indians are unable to visit the #UAE as the country disapproves it Although #WHO hasn t a,1201836567150641152,1,United Kingdom ,Weakly_Negative
756,2021-12-30 05:28:56,1476425045366829059,Series Sushant amp His Girlfriends Sara Ali Khan Part 1 Sara Ki Sari,1298678243239890947,4,"New Delhi, India",Neutral
757,2021-12-30 05:28:05,1476424834607321088,#Covaxin Traditional non mRNA platform has a good safety profile is effective against varian,86626845,0,"California, USA",Weakly_Positive
758,2021-12-30 05:27:15,1476424625173245953,Father thank you for using your platform for bring #covaxin to the light The,932013864,0,"Philadelphia, PA",Weakly_Positive
759,2021-12-30 05:26:43,1476424488707235841,So we re #1 Surprised Biden didn t retweet as such He was boasting all day about how great the econom,86626845,0,"California, USA",Weakly_Positive
760,2021-12-30 05:15:24,1476421640376356870,How many more have to died to stop with the corruption Why have the not approve #Covaxin a safe vaccine fo,208120290,0,,Highly_Positive
761,2021-12-30 05:14:24,1476421390710583297,Louder from the people in the back Father We deserve better we deserve,785323158962221056,1,,Weakly_Positive
762,2021-12-30 05:12:18,1476420859434655747,Louder from the people in the back Father We deserve better we deserve #COVAXIN,932013864,1,"Los Angeles, CA",Weakly_Positive
763,2021-12-30 05:12:15,1476420848454184962,Want to get the word out about #COVAXIN #Covaxin4Kids and Then click the link below and submit a questi,876589381791997952,1,Texas,Neutral
764,2021-12-30 04:54:08,1476416288130019329,Imagine what big pharma #Pfizer and #Moderna is doing Exactly what is doing Making Covid great again by su,5920532,4,,Weakly_Positive
765,2021-12-30 04:53:41,1476416174858510349,Only if can HEAR YOU #COVAXIN is indeed what I would take,932013864,0,The Moon,Neutral
766,2021-12-30 04:52:53,1476415974190596097,Now imagine what big pharma #Pfizer and #Moderna is doing Exactly what is doing,18831926,0,,Weakly_Positive
767,2021-12-30 04:49:21,1476415087485280262,Help end this pandemic #Covaxin has been administered to gt 130 mil including pregnant women amp children,3103505578,0,,Weakly_Positive
768,2021-12-30 04:48:16,1476414814150963201,Help end this pandemic #Covaxin has been administered to gt 130 mil including pregnant wo,32313637,0,,Weakly_Positive
769,2021-12-30 04:44:25,1476413844058632192,#COVAXIN CAN HELP AND BE A REASONABLE ANSWER AND SOLUTION,40156330,0,The Moon,Weakly_Positive
770,2021-12-30 04:38:59,1476412475604017152,Government approves vaccination for kids aged 15 18 starting from 3rd January 2022 Get your child ready to get jabbed th,900657903148847104,1,Lucknow,Weakly_Positive
771,2021-12-30 04:38:40,1476412397241790471,Why the delays on available alternatives like #Covaxin Do you not see the state of emergency we re in,208120290,1,"California, USA",Weakly_Positive
772,2021-12-30 04:34:37,1476411375773569027,Maybe and send bonuses to amp to get,18831926,0,The Moon,Neutral
773,2021-12-30 04:33:26,1476411080691929095,#covaxin from #ocugen will end the pandemic,1602462295,0,,Neutral
774,2021-12-30 04:32:15,1476410782879469571,#covaxin from #ocugen will end the pandemic,2985479932,0,,Neutral
775,2021-12-30 04:31:37,1476410623001042944,#covaxin from #ocugen will end the pandemic,1094675842863693824,0,,Neutral
776,2021-12-30 04:31:34,1476410608094380033,Stop blaming the unvaccinated that s the media narrative to divide us #covaxin is on desk sin,593289567,4,,Neutral
777,2021-12-30 04:31:22,1476410558647832578,#covaxin from #ocugen will end the pandemic,1474970155117539332,0,,Neutral
778,2021-12-30 04:30:34,1476410359925903363,#covaxin from #ocugen will end the pandemic,1668322038,0,,Neutral
779,2021-12-30 04:30:00,1476410217491484674,#covaxin from #ocugen will end the pandemic,81300237,0,,Neutral
780,2021-12-30 04:29:18,1476410040030580737,#covaxin from #ocugen will end the pandemic,133027585,1,,Neutral
781,2021-12-30 04:28:49,1476409919540809729,#covaxin from #ocugen will end the pandemic,4305051193,1,,Neutral
782,2021-12-30 04:28:18,1476409788556791814,#covaxin from #ocugen will end the pandemic,1348744342123540484,0,,Neutral
783,2021-12-30 04:26:42,1476409385152884742,Help end this pandemic #Covaxin has been administered to gt 130 mil including pregnant women amp children in,148529707,0,,Weakly_Positive
784,2021-12-30 04:26:16,1476409278290350083,Help end this pandemic #Covaxin has been administered to gt 130 mil including pregnant women amp children,11347122,0,,Weakly_Positive
785,2021-12-30 04:19:43,1476407626632208388,to commence #Covaxin export to 60 countries in 2022 Bharat Biotech is preparing for a large s,2590932906,7,,Weakly_Positive
786,2021-12-30 04:17:33,1476407084363272195,#Covaxin the most effective and affordable one against delta variant is still not within the reach of com,148529707,0,राजपुताना ,Highly_Positive
787,2021-12-30 04:13:03,1476405950328160258,COVID 19 vaccine for children aged 15 18 is approved by the government Keep your child guarded by vaccinating them agains,1648263324,2,"Karimnagar, India",Weakly_Positive
788,2021-12-30 04:03:49,1476403628701360133,45 #URBAN #Bengaluru #CovidVaccine Availability for 30 12 at 09 30AM FREE Slots 0 PAID Slots #COVISHIELD Dose1 120 Dose2 1,1406895607680102404,1,,Weakly_Positive
789,2021-12-30 04:01:02,1476402924192288769,stop corruption approve #COVAXIN,208120290,0,,Neutral
790,2021-12-30 03:54:52,1476401373180796929,Help end this pandemic #Covaxin has been administered to gt 130 mil including pregnant women amp children in,148529707,0,,Weakly_Positive
791,2021-12-30 03:34:57,1476396360177885190,when will you approve #COVAXIN We need it really bad in the US I thought you wanted to fast track,1315423197878259715,3,"Spokane, WA",Highly_Negative
792,2021-12-30 03:34:55,1476396353009815554,I am rooting for all nurses but there s about 10k of us been trying to asked,21146733,0,,Neutral
793,2021-12-30 03:30:01,1476395120559902720,India has 4x our population yet has much lower covid cases They re using a variety of vaccines none mRNA,1473507662,1,,Weakly_Positive
794,2021-12-30 03:22:58,1476393345995923463,Oh so what you re trying to say is #Pfizer is NOT the answer amp like the POLIO v,975200486,0,"Syracuse, NY ",Neutral
795,2021-12-30 03:21:36,1476393003564552194,Oh so what you re trying to say is #Pfizer is NOT the answer amp like the POLIO vaccine that 98 of humans,19722699,0,"Syracuse, NY ",Neutral
796,2021-12-30 03:19:14,1476392405117067270,Oh so what you re trying to say is #Pfizer is NOT the answer amp like the POLIO vaccine that 98 of humans c,1349149096909668363,0,"Syracuse, NY ",Neutral
