,DateTime,Tweet_Id,Tweet,User_Id,Retweet,Location,Label
322,2021-12-29 22:31:08,1476319905117085700,Where you at on #Covaxin,53097729,1,,Neutral
323,2021-12-29 22:19:58,1476317094329430024,Approve #COVAXIN and give people a choice,1349149096909668363,0,,Neutral
324,2021-12-29 22:12:28,1476315208159313933,IF IT S NOT ABOUT APPROVING #COVAXIN WE DO NOT CARE,1217198127591186437,0,,Neutral
325,2021-12-29 22:09:55,1476314565478543362,#Covaxin has been administered to gt 130 million including pregnant women amp children over 2 w no major adver,1349149096909668363,0,"California, USA",Weakly_Positive
326,2021-12-29 22:08:14,1476314139429519360,Do you not see the crisis we re in Stop deflecting amp tell us what you re doing to better handle the pandemi,1349149096909668363,0,"California, USA",Highly_Positive
327,2021-12-29 22:07:17,1476313903130980360,#Covaxin a traditional vaccine is the best Covid 19 vaccine not available because of POLIT,1217198127591186437,0,,Weakly_Positive
328,2021-12-29 22:03:49,1476313028899577857,I beg to differ #COVAXIN stimulates a broad immune response neutralizing IgG mucosa,760219193195302912,5,"Toronto, Ontario",Weakly_Positive
329,2021-12-29 22:01:54,1476312547212947459,why do you continue to let #Pfizers US FDA to kill the American people We need a non mRNA vaccine option #COVAXIN #Covaxin4Kids,1349149096909668363,0,"Zoo Town, MT",Neutral
330,2021-12-29 21:58:19,1476311643780964365,When will this country have a real conversation about vaccine MRNA based Pfizer Moderna an,1217198127591186437,0,,Weakly_Positive
331,2021-12-29 21:48:43,1476309229619269638,#COVAXIN kids are increasingly being admitted to hospitals We need a safe vaccine that would have NO,1301206340069715970,1,,Highly_Positive
332,2021-12-29 21:45:50,1476308503803408385,Why does the country of India with 1 38 billion people and access to #COVAXIN a non mRNA tr,1217198127591186437,2,,Neutral
333,2021-12-29 21:45:09,1476308331304153091,Omg Nowhere did I say that he said people had to get it and I know undoubtedly that he would never in,876951534,1,Sacramento CA,Neutral
334,2021-12-29 21:40:18,1476307112615686144,Lol what is this #covaxin,1217198127591186437,0,Nederland,Highly_Positive
335,2021-12-29 21:33:35,1476305419970785289,1 billion doses of #COVAXIN a year Great news guys,1394750067429498882,5,,Highly_Positive
336,2021-12-29 21:24:40,1476303177720819715,This is why #COVAXIN is the ultimate Vaccine that truly works Not,18831926,0,,Neutral
337,2021-12-29 21:23:24,1476302859297824776,Thoughts and prayers with you BTK and these dear little ones They deserve #COVAXIN When are we g,1456357158803709958,0,"Ohio, USA",Highly_Negative
338,2021-12-29 21:21:13,1476302307671347209,May you PLEASE use your enormous platform prestige success amp success to advocate,1500129642,0,"Syracuse, NY ",Weakly_Positive
339,2021-12-29 21:19:30,1476301877130240003,May you PLEASE use your enormous platform prestige success amp success to advocate for more vaccine opti,1425860048539037697,1,Hiding in plain sight,Weakly_Positive
340,2021-12-29 21:19:29,1476301871082090502,May you PLEASE use your enormous platform prestige success amp success to advocate for more vaccine options,1425860048539037697,1,Hiding in plain sight,Weakly_Positive
341,2021-12-29 21:16:03,1476301009647386625,We have #COVAXIN waiting for approval,17050255,0,"Los Angeles, CA",Neutral
342,2021-12-29 21:15:28,1476300860565209091,May you PLEASE use your enormous platform prestige success amp success to advocate for more vaccine o,27796499,1,"Syracuse, NY ",Weakly_Positive
343,2021-12-29 21:13:28,1476300359819665409,You guys keep playing games Approve #COVAXIN already Stop playing with peoples live,146569971,0,,Weakly_Positive
344,2021-12-29 21:11:23,1476299834449608708,May you PLEASE use your enormous platform prestige success amp success to advocate for more vacci,121574367,1,"Syracuse, NY ",Weakly_Positive
345,2021-12-29 21:09:36,1476299384606408705,#COVAXIN kids are increasingly being admitted to hospitals We need a safe vaccine that would have,975200486,1,,Highly_Positive
346,2021-12-29 21:07:37,1476298886994092033,First we need,1552495290,0,"Braunschweig, Germany",Weakly_Positive
347,2021-12-29 20:59:07,1476296746787610625,why is no one questioning why the keep delaying #COVAXIN Look,8839632,0,,Neutral
348,2021-12-29 20:54:48,1476295660051783683,#COVAXIN is the only vaccine pending pediatric EUA from the We cannot wait for,759251,0,,Neutral
349,2021-12-29 20:48:43,1476294130183507971,Efforts were made to prevent #Covaxin from gaining recognition #CJIRamana The industrial subt,215704224,0,India,Neutral
350,2021-12-29 20:44:52,1476293160611504130,Or the parents have made a decision not to receive the vaccines offered because there are safer,1195385053406212098,0,New Jersey ,Neutral
351,2021-12-29 20:29:37,1476289321535741955,When #COVAXIN,208120290,0,Monroe N.Y. ,Neutral
352,2021-12-29 20:26:01,1476288418262962182,needs to have a Q amp A with all investors Let us know what is really goin,2215812403,0,"Boca Raton, FL",Weakly_Positive
353,2021-12-29 20:24:23,1476288004486414340,Thank you Maybe you can help champion the push to give #COVAXIN EUA,1349175483989188608,0,,Neutral
354,2021-12-29 20:21:05,1476287176040017920,Show us some great resources for #COVAXIN please,19658936,0,,Highly_Positive
355,2021-12-29 20:18:48,1476286602951331841,Assuming your healthcare provider has heard of #COVAXIN,19658936,0,,Neutral
356,2021-12-29 20:15:12,1476285696122007561,You really should act NOW #COVAXIN #covaxinapproval,208120290,0,,Weakly_Positive
357,2021-12-29 19:56:44,1476281048673751042,Setting records way to go champ Maybe we should try something else to get real results #covaxin or n,1349149096909668363,0,,Weakly_Positive
358,2021-12-29 19:54:58,1476280605147082756,Or get a real vaccine results are the real data here #covaxin or nothing #fjb,146569971,0,,Weakly_Positive
359,2021-12-29 19:54:15,1476280423793795079,Where is #COVAXIN A vaccine based on a traditional platform An EUA application has been on the desk of,1345129330926620673,1,dublin,Neutral
360,2021-12-29 19:51:11,1476279650070548482,Where is #COVAXIN A vaccine based on a traditional platform An EUA application has been on the desk of,146569971,1,"Minneapolis, MN",Neutral
361,2021-12-29 19:46:42,1476278523258187785,politics or pandemic USA vs India it s blatantly obvious we need #COVAXIN that the already tweeted ab,124237063,0,,Neutral
362,2021-12-29 19:39:21,1476276675163746305,#Covaxin Traditional non mRNA platform has a good safety profile is effective against variants amp doesn t,1349149096909668363,0,"California, USA",Weakly_Positive
363,2021-12-29 19:38:23,1476276429490769924,Please focus covid numbers are spiking When will you help us get #Covaxin,1349149096909668363,0,"California, USA",Neutral
364,2021-12-29 19:26:09,1476273352847335426,Like the previous nihdirector please look into #COVAXIN,1462069122016198659,1,,Highly_Negative
365,2021-12-29 19:25:12,1476273110819168264,OCGN why don t make a plan B and apply for approval at the EMA why focus so on Canada and the USA when t,876589381791997952,0,,Neutral
366,2021-12-29 19:19:48,1476271755371053057,Get us #covaxin is ready to deliver We need approval to beat #COVID19 and #OmnicronVariant NOW,1349149096909668363,0,,Weakly_Positive
367,2021-12-29 19:15:32,1476270680249405445,Like the previous nihdirector please look into #COVAXIN,124237063,1,,Highly_Negative
368,2021-12-29 18:59:58,1476266760429056001,Spain with gt 80 of the population vaccinated currently breaks records in contagions by covid MR,208120290,0,santiago de compostela,Neutral
369,2021-12-29 18:49:44,1476264185663307784,Approve #novavax #medicago #COVAXIN now,36375825,0,,Neutral
370,2021-12-29 18:41:04,1476262004222533640,You know what would be a better choice for everyone that wants to be vaccinated I m against mandates and control,1448614625935769604,1,,Weakly_Positive
371,2021-12-29 18:38:23,1476261332768813056,The truth can not be silenced #COVAXIN #OCUGEN OCGN,1422151264830464000,2,Metaverse ,Neutral
372,2021-12-29 18:30:27,1476259332824219654,When US will approve #Covaxin India can keep sucking to US,13218102,0,Belgium,Neutral
373,2021-12-29 18:26:45,1476258401843826688,They can only pile the corruption so high before it will come crashing down Sadly man,1392274772554260483,0,,Highly_Negative
374,2021-12-29 18:23:27,1476257574538338308,This is what got Robert Malone MD Twitter account suspended He s the inventor of mRNA vaccines Isn,39844876,0,,Neutral
375,2021-12-29 18:09:49,1476254142192443393,How many more Americans have to die using failing mRNA vaccines We want Vaccine options A safer more effec,1349149096909668363,0,"Zoo Town, MT",Highly_Positive
376,2021-12-29 18:04:37,1476252832743387139,It seems that has not yet applied for #COVAXIN s approval in EU Such ignorance is making #COVA,1268385206681112576,5,"Pune, Maharashtra",Neutral
377,2021-12-29 18:00:59,1476251918116986882,twitter just banned the inventor of mRNA for speaking up about,939091,0,"Zoo Town, MT",Neutral
378,2021-12-29 17:56:31,1476250792667631624,hire the right lobbyists and you ll get your #covaxin foot in the door OCGN,876589381791997952,0,Underwater in Massacusetts,Weakly_Positive
379,2021-12-29 17:55:22,1476250506301513729,Why ban a man for telling the truth #Truth #Covaxin4Kids #COVAXIN #REALVACCINE #OCGN,1458235189444988929,1,,Neutral
380,2021-12-29 17:53:55,1476250141950676997,Or bring in #covaxin instead of using vaccines that don t work,2704294333,0,,Neutral
381,2021-12-29 17:53:13,1476249963642318854,Team #covaxin I waited for 48 hrs so they can open a new batch for me No Covi shield for me,1430392414569590788,0,Bharat 🛕,Weakly_Positive
382,2021-12-29 17:52:14,1476249717638307840,Why ban a man for telling the truth #Truth #Covaxin4Kids #COVAXIN #REALVACCINE #OCGN,208120290,1,,Neutral
383,2021-12-29 17:50:14,1476249214653018122,sirjii Pfizer use his power and politics badl,471741741,0,,Neutral
384,2021-12-29 17:47:54,1476248624237481984,Doctors from 3rd January #PMModi #Covaxin #Omicron #OmicronInIndia,1266556209479462920,15,"New Ashok Nagar, New Delhi",Neutral
385,2021-12-29 17:44:22,1476247738564194306,As our government currently sits on a safe vaccine for children ages 2 to 5 with no communication about it It was never,1101224749085179904,3,Mid-Gulf Coast of Florida,Weakly_Positive
386,2021-12-29 17:44:11,1476247692007325698,PFIZER RULES THE USA WAKE UP PEOPLE BEFORE ITS TOO LATE the best covid vaccine #covaxin,15392486,0,Monroe N.Y. ,Weakly_Positive
387,2021-12-29 17:41:41,1476247061175709704,If you have children listen to this I will not allow my children to be harmed #COVAXIN #OCUGEN OCGN,1422151264830464000,11,,Neutral
388,2021-12-29 17:41:11,1476246937573609473,Mr President with respect I want to ask r u serious with Americans Why v just have #mRNA vacc,939091,5,USA/India,Highly_Negative
389,2021-12-29 17:26:32,1476243250319036416,Dear Ocugen I though we re on Same Page Eventhough You Vax is Late Stage We Look Eye To Eye Told We Got This,1449092858418372608,1,United States,Highly_Negative
390,2021-12-29 17:25:52,1476243082748129283,Dear Ocugen I though we re on Same Page Eventhough You Vax is Late Stage We Look Eye To Eye Told We Got T,876589381791997952,1,United States,Highly_Negative
391,2021-12-29 17:23:25,1476242465761992705,Criminal you ve not authorised #COVAXIN mind You really need to speak up and tell us what your plans are or time scale,208120290,0,,Highly_Negative
392,2021-12-29 17:22:54,1476242336380334098,When is it allowed to publish Omicron results or are these results poor and not published,2590932906,0,,Highly_Negative
393,2021-12-29 17:21:43,1476242036827332608,How much do you think Pfizer BigPharma is making by controlling the narrative amp buying p,19316848,6,Mid-Gulf Coast of Florida,Weakly_Positive
394,2021-12-29 17:20:41,1476241775723438080,Get the told that #COVAXIN offers this immunity I am flabbergasted this still hasn t been authorised,2855536962,0,,Weakly_Positive
395,2021-12-29 17:20:25,1476241709579309059,#COVAXIN OCGN,48459553,0,Hiding in plain sight,Neutral
396,2021-12-29 17:19:56,1476241588770598913,Sarojini Nagar market operates on an odd even basis as per Delhi government order Due to increase in covid cases in New,1388356971305209857,1,"New Delhi, India",Highly_Negative
397,2021-12-29 17:17:01,1476240855451123718,They ve obviously given up #COVAXIN,18831926,0,,Neutral
398,2021-12-29 17:07:35,1476238480128847878,Kayleigh I m a strong fan of you be a hero and mention on TV #COVAXIN,259001548,0,Monroe N.Y. ,Weakly_Positive
399,2021-12-29 17:02:59,1476237321527873548,Can you address the #Covaxin vaccine and why the government fails to speak about it,259001548,0,New Jersey ,Weakly_Negative
400,2021-12-29 17:01:39,1476236986570706949,#COVAXIN EXPO TO 60 COUNTRIES OVER BILLION OF DOSES,53097729,11,"Fort Lauderdale, FL",Neutral
401,2021-12-29 16:59:56,1476236553164783621,#COVID19 kids are mostly now suffering it is greater than 4X in kids,208120290,0,,Highly_Positive
402,2021-12-29 16:44:57,1476232782879862784,Best wishes to them A 3 of my kids caught Covid last week too because someone with clear symptoms de,1456357158803709958,0,,Weakly_Positive
403,2021-12-29 16:44:27,1476232658283745281,It would be kind enough if applies for review of COVAXIN in Germany as well so that we can save our money,1146125254856548354,12,"Bengaluru, India",Weakly_Positive
404,2021-12-29 16:40:08,1476231570801496068,That s why we need a real #pediatric #vaccine like #COVAXIN a traditional vacci,706474578,2,,Weakly_Positive
405,2021-12-29 16:39:45,1476231475670528001,We are in need of a new vaccine not a shot or booster Few understand this,18831926,0,"Central Elgin, Ontario",Highly_Negative
406,2021-12-29 16:36:41,1476230704182738950,Nobody wants a band aid that will only prevent death for 2 months and doesn t protect against transmi,36375825,4,,Weakly_Positive
407,2021-12-29 16:30:04,1476229040046551050,How many times do I have to tweet #COVAXIN at you Where s the journalistic curiosity Stop #COVID19,1456365100697219086,1,Angola,Highly_Positive
408,2021-12-29 16:29:55,1476229002692120579,How about #COVAXIN our numbers in the US continue to rise yet India declines There were 10x more cases in NY,1364722716151083011,1,Angola,Highly_Positive
409,2021-12-29 16:25:23,1476227858435616783,I would not recommend that they had been zero studies Push for and ask for #COVAXIN,1118995759104450560,0,"Central Elgin, Ontario",Neutral
410,2021-12-29 16:19:47,1476226451846410244,It s also interesting to me that a heavily populated country like India who has access to #COVAXIN,146569971,0,,Weakly_Positive
411,2021-12-29 16:18:50,1476226211865153548,Who is responsible to killing life and future It s so painful why don t you approve,208120290,0,,Highly_Negative
412,2021-12-29 16:12:41,1476224663646785546,This whole pandemic has been an orchestrated money grab Jack please look into #covaxin It s a traditiona,1217482696126894080,1,💨 🏙,Weakly_Positive
413,2021-12-29 16:11:49,1476224444771315720,This whole pandemic has been an orchestrated money grab Jack please look into #covaxin It s a trad,592730371,1,,Weakly_Positive
414,2021-12-29 16:08:49,1476223692342390784,In my best Jimi Hendrix voice hey Joe where u going with those bags full of #Pfizers US FDA money in,939091,0,"Zoo Town, MT",Highly_Positive
415,2021-12-29 16:08:31,1476223614240407564,Of course you have still not giving Canadian families a choice over the mRNA We demand #COVAXIN a,36375825,0,,Neutral
416,2021-12-29 16:08:30,1476223609597267971,Do you really think these people care about your well being Clearly,1349149096909668363,0,,Weakly_Positive
417,2021-12-29 16:06:51,1476223195162333193,What about #COVAXIN Don t you want to offer the Canadian population an alternative and thus block ac,36375825,0,,Neutral
418,2021-12-29 16:05:24,1476222829268029443,How long before #covaxin is approved #vaccigen,36375825,0,,Highly_Negative
419,2021-12-29 16:02:37,1476222129372733441,Sir why Conservative party ask to approve #COVAXIN you can see sir India 1 4 billion n canada 38 million c,1394750067429498882,35,Europe,Neutral
420,2021-12-29 16:01:23,1476221821414371328,Taken vaccine #COVAXIN is enough for the #OmicronVarient percautions tive,56304605,0,India,Neutral
421,2021-12-29 16:01:16,1476221789575417857,Corruption over Human Lives We will wake up America #COVAXIN,1080137435223412736,1,Europe,Neutral
422,2021-12-29 16:01:11,1476221770172551169,How I feel buying another dip OCGN #OCGN #COVAXIN #COVAXIN4KIDS,1417945520442642436,1,Europe,Neutral
423,2021-12-29 16:00:33,1476221611162304520,So if the bent the rule from 10 days isolation to 5 days because the CEO of Delta wrote them a letter stating i,1395910534877257731,2,Europe,Neutral
424,2021-12-29 15:59:57,1476221460599357442,Where is #covaxin,1345129330926620673,1,Europe,Neutral
425,2021-12-29 15:59:24,1476221320476061698,Approve #COVAXIN,1456967480237346821,1,Europe,Neutral
426,2021-12-29 15:59:21,1476221306538319876,If the plan doesn t include #Covaxin then the endgame is a mute point,468986786,1,Europe,Neutral
427,2021-12-29 15:58:57,1476221209184374784,mRNA is not working STOP the great human mRNA experiment #COVAXIN #COVAXIN4KIDS proven safer amp more effective,1216023242311290880,1,Europe,Weakly_Positive
428,2021-12-29 15:58:55,1476221199453548547,We need #COVAXIN,1469779095244488709,1,Europe,Neutral
429,2021-12-29 15:58:53,1476221190557421569,Maybe it s time to approve #COVAXIN,251719428,1,Europe,Neutral
430,2021-12-29 15:57:50,1476220927956422662,Just few understand #COVAXIN #OCUGEN,53097729,2,"Fort Lauderdale, FL",Highly_Negative
431,2021-12-29 15:57:34,1476220861816328204,More of the same Countries using primarily mRNA vaccines like UK US Denmark Germany amp Irelan,1473507662,2,Europe,Weakly_Positive
432,2021-12-29 15:52:48,1476219660873965569,Maybe it s time to approve #COVAXIN,30354991,1,United Kingdom,Neutral
433,2021-12-29 15:52:22,1476219550999871489,We all would need #3rd dose of both #Covishield and #Covaxin and perhaps additional #4th dose for #Covaxin Time will tel,1073180418868793345,214,"Navi Mumbai , India",Neutral
434,2021-12-29 15:51:32,1476219342375174145,Good news for travelers from India #Covaxin and #Covovax have been approved by the Austrian Federal Government for t,3255239379,2,New Delhi,Highly_Positive
435,2021-12-29 15:45:38,1476217855536508936,We need #COVAXIN,15754281,1,,Neutral
436,2021-12-29 15:45:15,1476217759277092866,mRNA is not working STOP the great human mRNA experiment #COVAXIN #COVAXIN4KIDS proven safer amp more e,939091,1,"Zoo Town, MT",Weakly_Positive
437,2021-12-29 15:44:01,1476217448626073606,#Covaxin a traditional vaccine is the best Covid 19 vaccine not available because of POLITICS,125140561,0,,Weakly_Positive
438,2021-12-29 15:43:39,1476217357240438785,#covaxin yet not approve in Kuwait,98352497,0,"Gaya, India",Neutral
439,2021-12-29 15:43:20,1476217278974902276,Are you aware of a vaccine called #Covaxin a traditional vaccine that has clinical trial data agai,125140561,2,,Weakly_Positive
440,2021-12-29 15:42:42,1476217117393494017,If the plan doesn t include #Covaxin then the endgame is a mute point,1917731,1,,Neutral
441,2021-12-29 15:40:53,1476216659602034697,Approve #COVAXIN,1349149096909668363,1,,Neutral
442,2021-12-29 15:36:21,1476215521880252416,you know who made money from this #COVAXIN scam SHANKY He s selling by every peak and then this blee,876589381791997952,0,Monroe N.Y. ,Neutral
443,2021-12-29 15:33:41,1476214849591992327,has the answer right NOW through in care of their USA P,927604589909733376,0,,Weakly_Positive
444,2021-12-29 15:33:07,1476214705773502468,Where is #covaxin,1323730225067339784,1,"Minneapolis, MN",Neutral
445,2021-12-29 15:30:47,1476214118503763969,Y is FDA not accelerating s #covaxin This is about the lives of peo,1349149096909668363,1,Seattle,Neutral
446,2021-12-29 08:26:22,1476107312490180611,1 #vaccination of children 15 18 years to start with #Covaxine from 3rd Jan 2 #BoosterShots for FLH workers amp 60 a,1550194063,1,Dharamjaigarh,Neutral
447,2021-12-25 18:01:33,1474802507809366020,Please make trial data public in public interest #covaxine #vaccination,134758540,0,somewhere in Asia,Neutral
448,2021-12-25 17:48:33,1474799236608761858,Data of Trial of #covaxine on kids must be publicly avai,461841349,0,somewhere in Asia,Neutral
449,2021-12-23 16:12:41,1474050335526240256,when will you rate the #covaxine vaccine the times are ripe omicron advances for the sake of our children,208120290,0,,Neutral
450,2021-12-23 16:10:30,1474049787779502080,when will you rate the #covaxine vaccine the times are ripe omicron advances for the sake of o,208120290,0,,Neutral
451,2021-12-30 15:29:06,1476576082665123850,Let your voice be heard Tweet retweet do it for the children #Covaxin #Ocugen,876589381791997952,4,,Neutral
452,2021-12-30 15:22:33,1476574436404854787,#BharatBiotech announced that #Covaxin has proven to be safe well tolerated and immunogenic in 2 18 age group in phas,4767528991,2,Bangalore,Highly_Positive
453,2021-12-30 15:16:39,1476572952376365056,DONT EVER FORGET #Covaxin #Ocugen #BharatBiotech #Covid19 #Vaccine,876589381791997952,3,,Neutral
454,2021-12-30 15:14:34,1476572428377767940,You can not argue with the data Today science speaks The righteous shall prevail #Covaxin #Ocugen,876589381791997952,0,,Neutral
455,2021-12-30 15:09:41,1476571198867787779,What more do you want #Covaxin is what we want need #Covaxin #Ocugen,208120290,3,,Highly_Positive
456,2021-12-30 14:52:44,1476566930483863554,#Vaccine for Kids #Covaxin safe well tolerated and immunogenic in 2 18 year old volunteers says #BharatBiotech,231692806,2,"Mumbai, INDIA.",Weakly_Positive
457,2021-12-30 14:15:00,1476557435187855362,#Covid19 vaccine Covaxin maker #BharatBiotech claimed that the vaccine is safe well tolera,1130728251255508993,25,Chennai,Highly_Positive
458,2021-12-30 13:53:02,1476551908093399042,#BharatBiotech says #Covaxin is safe for children between 2 18 years,3106565906,0,"Hyderabad, Telangana, India",Highly_Positive
459,2021-12-30 13:39:25,1476548479673532416,#Covaxin has proven to be safe well tolerated and immunogenic in 2 18 years of age volunteers who participated in Pha,161318053,1,,Highly_Positive
460,2021-12-30 13:37:28,1476547988692488194,Time to #vaccinate and make #Indian Kids Safe too #BharatBiotech #COVID19,631810714,0,"Anytown, USA",Highly_Positive
461,2021-12-30 13:10:33,1476541216279785473,As predicted by Great Visionary Dr jee #Breaking Covaxin has proven to be safe well t,60937837,3,,Highly_Positive
462,2021-12-30 04:38:59,1476412475604017152,Government approves vaccination for kids aged 15 18 starting from 3rd January 2022 Get your child ready to get jabbed th,900657903148847104,1,Lucknow,Weakly_Positive
463,2021-12-29 23:00:39,1476327333523070982,#Covaxin a traditional Inactivated vaccine made in India should be a topic of discussion #Covaxin is the,468986786,1,,Neutral
464,2021-12-29 22:46:30,1476323772420530181,#Covaxin a traditional Inactivated vaccine made in India should be a topic of discussion #Covaxin,1217198127591186437,1,,Neutral
465,2021-12-29 11:37:33,1476155425871568899,When will the U S return the favor #Covaxin #Ocugen #BharatBiotech #Covid19,593289567,0,,Neutral
466,2021-12-29 09:42:41,1476126519323934721,#Covid #vaccination drive #BharatBiotech to pay compensation if #Covaxin causes side effects ht,39743812,9,,Neutral
467,2021-12-29 05:49:11,1476067756122517506,After #BharatBiotech s #CoVaxin now another #Covidvaccine from #Telangana based #BiologicalE with #CorbeVax Biological,104813117,1,telanganart@gmail.com,Neutral
468,2021-12-29 03:19:34,1476030103729623042,The suffering and long term consequences experienced by these kids can be directly attributed to the people on the FDA s,1209495528,1,,Weakly_Positive
469,2021-12-28 22:55:45,1475963711403839495,We need Covaxin #Covaxin #Ocugen #BharatBiotech #Covid19 #Vaccine,208120290,11,,Neutral
470,2021-12-28 21:45:56,1475946141317578753,WE NEED APPROVAL #Covaxin #Ocugen #BharatBiotech #Covid19 #Vaccine,208120290,6,,Neutral
471,2021-12-28 21:18:29,1475939234544504842,Come on no need to wait on big brother USA Lead by example #Covaxin #Ocugen,14260960,4,,Neutral
472,2021-12-28 19:21:27,1475909780900302861,I agree #Covaxin #Ocugen #BharatBiotech #Covid19 #Vaccine,3805847837,0,,Neutral
473,2021-12-28 17:44:11,1475885303608983555,So you ve done nothing since last week is what you re saying How about a proven vaccine rather than buying,1349149096909668363,0,,Neutral
474,2021-12-28 13:00:36,1475813935718801412,What s going on with FDA approval What s going on with Jubilant partnership and production,876589381791997952,3,London,Neutral
475,2021-12-28 11:24:32,1475789762548097026,Bharat Biotech Targets One Billion Doses of Intranasal COVID 19 Vaccine Annually #BharatBiotech #Intr,828841083257778176,1,,Neutral
476,2021-12-28 10:26:28,1475775147684425728,is targeting to make one billion doses of its #COVID19 intranasal vaccine annually while it is on t,2590932906,22,New Delhi,Neutral
477,2021-12-28 07:33:59,1475731741931237379,Is that one of the reasons why the PM waited for #bharatbiotech vaccine for kids t,854353186416676864,0,ghaziabd,Neutral
478,2021-12-28 05:11:13,1475695814009786369,COVID 19 Will precaution dose be the same as your first two doses Details here,471741741,0,"New Delhi, India",Weakly_Positive
479,2021-12-28 00:54:44,1475631266749980673,we need #COVAXIN #ocugen #BharatBiotech give the,1456357158803709958,0,United States,Neutral
480,2021-12-27 22:29:16,1475594657010786313,Lets keep spreading the word,759251,1,,Neutral
481,2021-12-27 22:21:23,1475592673574666244,Shelf Life Extension of COVAXIN #covaxin #COVID19 #covid #BharatBiotech #pandemic,208120290,0,,Neutral
482,2021-12-27 22:14:39,1475590980300689417,Lets keep spreading the word,759251,5,,Neutral
